id,gender,masterCategory,subCategory,articleType,baseColour,season,year,usage,productDisplayName,image
2482,18638,Men,Apparel,Topwear,Tshirts,Black,Fall,2011,Sports,Puma Men V.11 Speed Black Tshirts,18638.jpg
2485,2687,Women,Apparel,Topwear,Tshirts,Orange,Summer,2011,Casual,Inkfruit Women's Love Wood Orange T-shirt,2687.jpg
2487,3755,Men,Apparel,Topwear,Tshirts,Black,Summer,2011,Casual,Status Quo Men's Concerts Black T-shirt,3755.jpg
2491,6227,Men,Apparel,Topwear,Tshirts,Yellow,Summer,2011,Casual,Lee Men's Grey Yellowbrass T-shirt,6227.jpg
2492,17670,Women,Footwear,Shoes,Heels,Black,Winter,2015,Casual,Catwalk Women Fancy Black Heels,17670.jpg
2493,22597,Men,Apparel,Topwear,Tshirts,Orange,Fall,2011,Sports,Nike Men Orange T-shirt,22597.jpg
2496,54725,Women,Apparel,Topwear,Kurtas,Pink,Fall,2012,Ethnic,Shree Women Coral Coloured Printed Kurta,54725.jpg
2497,6829,Women,Footwear,Shoes,Sports Shoes,White,Summer,2011,Sports,Nike Women's Lunar Swift White Blue Shoe,6829.jpg
2498,12130,Women,Apparel,Topwear,Kurtas,Green,Fall,2011,Ethnic,Aurelia Women Printed Green Kurtas,12130.jpg
2499,26305,Men,Apparel,Topwear,Tshirts,Cream,Fall,2013,Casual,Proline Men Pack of 3 T-Shirts,26305.jpg
2500,3567,Men,Footwear,Shoes,Sports Shoes,Silver,Summer,2011,Sports,ADIDAS Men's Silver White Running Shoe,3567.jpg
2501,42640,Women,Apparel,Topwear,Kurtas,Red,Summer,2012,Casual,W Women Red Dress,42640.jpg
2502,23677,Men,Footwear,Sandal,Sandals,Brown,Summer,2012,Casual,Red Tape Men Cross Band Brown Sandals,23677.jpg
2506,6015,Men,Apparel,Topwear,Shirts,Black,Summer,2011,Casual,Highlander Men Small Black Checked Shirt,6015.jpg
2507,35712,Men,Footwear,Shoes,Sports Shoes,Grey,Summer,2012,Sports,Nike Men Dual Fusion TR III Grey Sports Shoes,35712.jpg
2510,15315,Men,Footwear,Shoes,Sports Shoes,Black,Fall,2011,Sports,ADIDAS Men Eqt Nitro Fashion Black Sports Shoes,15315.jpg
2511,4742,Women,Footwear,Shoes,Casual Shoes,Grey,Summer,2011,Casual,Numero Uno Women NY Grey Blue Shoe,4742.jpg
2512,5690,Men,Footwear,Shoes,Casual Shoes,Black,Winter,2015,Casual,Skechers Men Valence Envoy Black Shoe,5690.jpg
2516,24452,Men,Footwear,Shoes,Sports Shoes,White,Summer,2012,Sports,Nike Men White Court Shuttle IV Sports Shoes,24452.jpg
2519,14001,Men,Apparel,Topwear,Tshirts,Navy Blue,Fall,2011,Sports,Nike Men Solid Navy Blue Jerseys,14001.jpg
2520,20234,Women,Apparel,Topwear,Tshirts,Blue,Fall,2011,Casual,Wrangler Women Baroque Polo Turquoise T-shirt,20234.jpg
2522,37283,Women,Apparel,Topwear,Tshirts,Brown,Summer,2012,Casual,Tantra Women Brown Fight Peace T-shirt,37283.jpg
2523,44771,Men,Footwear,Shoes,Casual Shoes,Grey,Summer,2012,Casual,Globalite Men Navy Blue Skid Shoes,44771.jpg
2525,11573,Women,Apparel,Topwear,Kurtas,Green,Summer,2011,Ethnic,W Women Printed Green Kurtas,11573.jpg
2529,24694,Men,Apparel,Topwear,Tshirts,White,Summer,2012,Casual,Locomotive Men Striped White T-shirt,24694.jpg
2533,28865,Men,Apparel,Topwear,Tshirts,Brown,Summer,2012,Casual,Proline Men Brown Striped Polo T-shirt,28865.jpg
2538,34406,Men,Apparel,Topwear,Tshirts,Black,Summer,2012,Casual,Myntra Men Black Printed T-shirt,34406.jpg
2541,17684,Women,Footwear,Shoes,Casual Shoes,Grey,Winter,2015,Casual,Catwalk Women Ballerina Grey Casual Shoe,17684.jpg
2542,31948,Men,Footwear,Shoes,Sports Shoes,Blue,Summer,2012,Sports,Nike Men Air Pegasus Blue Sports Shoes,31948.jpg
2545,7301,Women,Apparel,Topwear,Tops,Blue,Summer,2011,Casual,UCB Women Stripe Short Sleeve Blue White Top,7301.jpg
2547,30294,Men,Apparel,Topwear,Tshirts,Off White,Summer,2012,Casual,Myntra Men Global Response Off White T-shirt,30294.jpg
2549,13016,Women,Footwear,Shoes,Heels,Brown,Winter,2012,Casual,Inc 5 Women Casual Brown Wedges,13016.jpg
2551,34634,Men,Footwear,Shoes,Casual Shoes,Brown,Summer,2012,Casual,Lotto Men Brown Fella Tres Shoes,34634.jpg
2553,8947,Men,Apparel,Bottomwear,Trousers,Grey,Fall,2011,Casual,Indigo Nation Men ID Printed Grey Trousers,8947.jpg
2554,22751,Women,Apparel,Topwear,Kurtas,White,Fall,2011,Ethnic,BIBA Women Printed White Kurta,22751.jpg
2557,5664,Men,Apparel,Topwear,Tshirts,Blue,Summer,2011,Casual,Tantra Men's Shloka Blue T-shirt,5664.jpg
2559,20006,Women,Apparel,Topwear,Tshirts,Green,Summer,2011,Casual,United Colors of Benetton Women Printed Green T-shirt,20006.jpg
2561,25574,Men,Footwear,Shoes,Sports Shoes,Black,Summer,2012,Sports,FILA Men Trempet Black & White Sports Shoes,25574.jpg
2563,11741,Men,Apparel,Topwear,Tshirts,Navy Blue,Fall,2011,Casual,Lee Men Stripes Navy Blue T-shirt,11741.jpg
2564,10693,Women,Apparel,Topwear,Tops,Purple,Fall,2011,Casual,Doodle Girl Cute Purple Tops,10693.jpg
2565,57154,Women,Apparel,Topwear,Tshirts,Grey Melange,Summer,2012,Casual,Elle Women Grey Melange T-shirt,57154.jpg
2567,19148,Men,Apparel,Topwear,Tshirts,Navy Blue,Summer,2011,Casual,United Colors of Benetton Men Navy Blue Polo Tshirt,19148.jpg
2569,26795,Men,Apparel,Topwear,Shirts,Blue,Summer,2013,Formal,Arrow Men Blue Shirt,26795.jpg
2571,49638,Women,Apparel,Topwear,Tops,Pink,Summer,2012,Casual,Mineral Women Pink Top,49638.jpg
2573,2025,Men,Apparel,Topwear,Tshirts,Grey,Fall,2010,Sports,ADIDAS Mens Full Grey T-shirt,2025.jpg
2577,19974,Women,Apparel,Topwear,Tshirts,Yellow,Summer,2011,Casual,United Colors of Benetton Women Yellow T-shirt,19974.jpg
2580,6485,Men,Apparel,Topwear,Tshirts,Grey,Summer,2011,Casual,ADIDAS Men's Grey Strip T-shirt,6485.jpg
2583,14657,Men,Apparel,Bottomwear,Trousers,Grey,Fall,2011,Casual,Probase Men Solid DK.Grey Trousers,14657.jpg
2584,33849,Men,Footwear,Shoes,Casual Shoes,Blue,Summer,2012,Casual,Puma Men Blue Shoes,33849.jpg
2589,57530,Men,Footwear,Shoes,Casual Shoes,Black,Fall,2012,Casual,Provogue Men Black Casual Shoes,57530.jpg
2590,33075,Men,Apparel,Topwear,Tshirts,Blue,Summer,2012,Casual,U.S.Polo Assn. Men Blue & Orange Striped T-shirt,33075.jpg
2591,40587,Women,Apparel,Topwear,Kurtas,Brown,Summer,2012,Ethnic,Aurelia Women Brown Kurta,40587.jpg
2592,41455,Men,Footwear,Sandal,Sandals,Grey,Summer,2012,Casual,Lee Cooper Men Grey Sandals,41455.jpg
2594,44315,Men,Apparel,Bottomwear,Trousers,Blue,Summer,2012,Casual,Indian Terrain Men Blue Trousers,44315.jpg
2595,36735,Women,Apparel,Topwear,Tshirts,Multi,Summer,2012,Casual,Spykar Women Cult Multi T-shirt,36735.jpg
2598,33247,Men,Apparel,Topwear,Shirts,Grey,Summer,2012,Formal,Arrow Men Grey Check Shirt,33247.jpg
2601,11117,Men,Apparel,Topwear,Shirts,Grey,Fall,2011,Formal,Indigo Nation Men Solid Grey Shirts,11117.jpg
2603,32395,Women,Apparel,Topwear,Shirts,Grey,Summer,2012,Formal,Arrow Woman Grey Shirt,32395.jpg
2605,12792,Men,Apparel,Topwear,Tshirts,Black,Fall,2011,Sports,Nike Men Manchester United Black Jersey,12792.jpg
2607,13640,Women,Footwear,Shoes,Flats,Purple,Winter,2012,Casual,Carlton London Women Purple Flat Shoes,13640.jpg
2611,16332,Men,Apparel,Topwear,Shirts,Red,Fall,2011,Formal,Peter England Men Stripes Red Shirt,16332.jpg
2614,47590,Women,Footwear,Shoes,Heels,Green,Winter,2012,Casual,Portia Women Green Sandals,47590.jpg
2618,56871,Women,Footwear,Shoes,Heels,Black,Winter,2012,Casual,HM Women Black Sandals,56871.jpg
2619,44588,Men,Apparel,Topwear,Shirts,White,Summer,2012,Casual,Scullers Men White & Navy Blue Check Shirt,44588.jpg
2620,32508,Men,Footwear,Sandal,Sandals,Brown,Winter,2015,Casual,Franco Leone Men Brown Sandals,32508.jpg
2622,21923,Women,Apparel,Topwear,Kurtas,Black,Fall,2011,Ethnic,BIBA Women Printed Black Kurta,21923.jpg
2624,10658,Women,Apparel,Topwear,Tops,White,Fall,2011,Casual,Doodle Girl Little frock White Tops,10658.jpg
2627,9062,Men,Apparel,Topwear,Shirts,Pink,Fall,2011,Formal,Mark Taylor Men Pink Striped Shirt,9062.jpg
2630,6816,Men,Footwear,Shoes,Casual Shoes,Brown,Summer,2011,Casual,Timberland Men's Desert Walnut Brown Shoe,6816.jpg
2631,3558,Men,Footwear,Shoes,Casual Shoes,Brown,Winter,2015,Casual,Skechers Men's Brown Casual Lifestyle Shoe,3558.jpg
2632,23648,Men,Apparel,Topwear,Tshirts,Maroon,Summer,2012,Casual,Disney Men Maroon Printed T-shirt,23648.jpg
2633,12933,Men,Apparel,Topwear,Tshirts,Green,Fall,2011,Casual,Classic Polo Men Broad Stripes Green Tshirts,12933.jpg
2634,54528,Men,Footwear,Shoes,Casual Shoes,White,Fall,2012,Casual,F Sports Men White Charger Shoes,54528.jpg
2636,9250,Men,Apparel,Topwear,Shirts,Red,Fall,2011,Formal,Mark Taylor Men Red Striped Shirt,9250.jpg
2640,30851,Women,Apparel,Topwear,Kurtas,Green,Summer,2012,Ethnic,Fabindia Women Printed Green Kurta,30851.jpg
2647,15118,Men,Apparel,Bottomwear,Trousers,Black,Fall,2013,Formal,Arrow Men Stripes Black Trousers,15118.jpg
2650,37248,Men,Footwear,Shoes,Casual Shoes,Brown,Summer,2012,Casual,United Colors of Benetton Men Brown Shoes,37248.jpg
2653,42029,Women,Footwear,Shoes,Sports Shoes,Purple,Summer,2012,Sports,ADIDAS Women Purple Chill Sports Shoes,42029.jpg
2654,12759,Women,Apparel,Bottomwear,Jeans,Blue,Fall,2011,Casual,Spykar Women Washed Blue Jeans,12759.jpg
2655,35947,Men,Apparel,Topwear,Shirts,White,Summer,2012,Casual,Flying Machine Men White Shirt,35947.jpg
2656,18263,Women,Apparel,Topwear,Kurtas,Yellow,Fall,2011,Ethnic,Aneri Women Nancy Yellow Kurta,18263.jpg
2657,9634,Men,Apparel,Topwear,Shirts,White,Fall,2011,Formal,Indigo Nation Men Price catch Black White Shirts,9634.jpg
2658,48513,Women,Apparel,Topwear,Tops,Black,Summer,2012,Casual,French Connection Women Black Top,48513.jpg
2659,23822,Men,Footwear,Flip Flops,Flip Flops,Red,Summer,2012,Casual,Puma Men Breeze Red Flip Flops,23822.jpg
2665,10832,Men,Apparel,Topwear,Tshirts,Green,Fall,2011,Casual,Wrangler Men American Music Folk Green T-Shirts,10832.jpg
2667,38664,Men,Footwear,Shoes,Casual Shoes,Grey,Fall,2012,Casual,Nike Men Liteforce Grey Shoes,38664.jpg
2668,4917,Women,Apparel,Topwear,Tops,Pink,Summer,2011,Casual,Gini and Jony Girl's Vollie Pink Kidswear,4917.jpg
2669,24835,Men,Footwear,Shoes,Casual Shoes,Brown,Fall,2011,Casual,Rockport Men Brown Cashaw Camel Suede Casual Shoes,24835.jpg
2672,32950,Unisex,Footwear,Shoes,Casual Shoes,Black,Summer,2012,Casual,ADIDAS Neo Unisex Court Sequence Black Shoes,32950.jpg
2673,52089,Women,Apparel,Topwear,Tshirts,Black,Summer,2012,Casual,Myntra Women Black T-shirt,52089.jpg
2674,4319,Unisex,Apparel,Topwear,Tshirts,Blue,Summer,2011,Casual,Tantra Kid's Unisex Free Spirit Turquoise Kidswear,4319.jpg
2676,39584,Women,Footwear,Shoes,Heels,Black,Winter,2015,Casual,Catwalk Women Black Heels,39584.jpg
2678,45802,Women,Footwear,Shoes,Heels,Black,Fall,2012,Casual,Senorita Women Black Flats,45802.jpg
2679,19183,Men,Apparel,Topwear,Shirts,Grey,Fall,2011,Casual,United Colors of Benetton Men Check Grey Shirt,19183.jpg
2680,9406,Men,Apparel,Topwear,Tshirts,Black,Fall,2011,Casual,Puma Men Scribble Graphic Black Tshirts,9406.jpg
2681,17825,Unisex,Footwear,Sandal,Sandals,Black,Fall,2011,Casual,Nike Unisex Air Deschutz Black Sandal,17825.jpg
2684,3900,Women,Apparel,Topwear,Tshirts,Pink,Summer,2011,Casual,Disney Kids Girl Pooh Pink And White Top,3900.jpg
2685,17019,Women,Footwear,Shoes,Flats,Brown,Fall,2013,Casual,Rocia Women Casual Brown Sandal,17019.jpg
2686,49435,Men,Footwear,Shoes,Casual Shoes,Blue,Fall,2012,Casual,Vans Men Blue Shoes,49435.jpg
2688,26598,Men,Footwear,Shoes,Sports Shoes,White,Summer,2012,Sports,Puma Men Faas 300 White Sports Shoes,26598.jpg
2690,18297,Women,Apparel,Topwear,Kurtas,Multi,Fall,2011,Ethnic,Aneri Women Kaalki Multi Coloured Kurta,18297.jpg
2691,34861,Men,Footwear,Shoes,Casual Shoes,Grey,Summer,2012,Casual,Vans Men Era Grey Shoes,34861.jpg
2695,6688,Women,Apparel,Topwear,Tshirts,Black,Summer,2011,Casual,UCB Women's V Neck Black T-shirt,6688.jpg
2699,43933,Women,Footwear,Shoes,Heels,Black,Winter,2012,Casual,Catwalk Women Black Heels,43933.jpg
2701,15588,Men,Apparel,Topwear,Shirts,Blue,Fall,2011,Casual,Spykar Men Striped Blue Shirt,15588.jpg
2703,5831,Men,Apparel,Topwear,Tshirts,Black,Summer,2011,Sports,Puma Men's Cbn Logo Black T-Shirt,5831.jpg
2705,39742,Men,Footwear,Shoes,Casual Shoes,Red,Summer,2012,Casual,Arrow Men Red Shoes,39742.jpg
2708,14668,Men,Apparel,Topwear,Shirts,White,Fall,2011,Casual,Basics Men White Slim Fit Checked Shirt,14668.jpg
2712,44924,Men,Apparel,Bottomwear,Jeans,Blue,Summer,2012,Casual,Jack & Jones Men Blue Jeans,44924.jpg
2713,39570,Women,Footwear,Shoes,Heels,Black,Winter,2015,Casual,Catwalk Women Black Heels,39570.jpg
2714,32198,Men,Apparel,Topwear,Kurtas,Grey,Summer,2012,Ethnic,Fabindia Men Printed Grey Kurta,32198.jpg
2716,19177,Men,Apparel,Topwear,Shirts,Navy Blue,Fall,2011,Casual,United Colors Of Benetton Men Navy Blue Shirt,19177.jpg
2718,49607,Women,Footwear,Shoes,Heels,Brown,Winter,2015,Casual,Catwalk Women Brown Heeled Shoes,49607.jpg
2722,7568,Men,Apparel,Topwear,Tshirts,Black,Summer,2011,Sports,Nike Men's Black Polo T-shirt,7568.jpg
2725,18899,Women,Apparel,Topwear,Tops,Maroon,Fall,2011,Casual,Arrow Woman Igor Maroon Top,18899.jpg
2727,41832,Men,Footwear,Shoes,Casual Shoes,Black,Fall,2012,Casual,Skechers Men Black Sneakers,41832.jpg
2728,4789,Men,Apparel,Topwear,Tshirts,Grey,Summer,2011,Sports,ADIDAS Men's Demon Grey T-shirt,4789.jpg
2729,56885,Women,Footwear,Shoes,Heels,Red,Winter,2012,Casual,HM Women Red Heels,56885.jpg
2733,24499,Women,Apparel,Topwear,Kurtas,Green,Fall,2011,Ethnic,Mother Earth Women Green Printed Kurta,24499.jpg
2734,20805,Men,Footwear,Flip Flops,Flip Flops,Olive,Fall,2010,Casual,Fila Men Rambler Olive Flip Flops,20805.jpg
2735,9096,Unisex,Footwear,Shoes,Casual Shoes,Blue,Fall,2011,Casual,Converse Unisex Ct As Star Chevron Hi Blue Casual Shoes,9096.jpg
2737,7930,Men,Apparel,Topwear,Tshirts,Black,Fall,2011,Casual,Proline Men Black Polo T-shirt,7930.jpg
2740,17489,Women,Footwear,Shoes,Flats,Off White,Fall,2011,Casual,Rockport Women Beige Flats,17489.jpg
2742,13815,Men,Apparel,Topwear,Tshirts,Grey,Fall,2011,Casual,Proline Pack of 3 Printed T-shirts,13815.jpg
2743,8978,Women,Footwear,Shoes,Casual Shoes,Purple,Fall,2011,Casual,Puma Women Saba Ballet DC3 Purple Casual Shoes,8978.jpg
2748,46825,Women,Footwear,Shoes,Casual Shoes,Off White,Winter,2015,Casual,Catwalk Women Off-White and Blue Pumps,46825.jpg
2749,19721,Men,Apparel,Topwear,Shirts,Grey,Fall,2011,Casual,United Colors Of Benetton Men Grey Shirt,19721.jpg
2750,34439,Women,Apparel,Topwear,Tshirts,White,Summer,2012,Casual,Myntra Women Explorer White T-shirt,34439.jpg
2754,31977,Women,Footwear,Shoes,Sports Shoes,Olive,Summer,2012,Sports,Nike Women Lunarswift +3 Olive Sports Shoes,31977.jpg
2755,46019,Women,Apparel,Topwear,Kurtas,White,Summer,2012,Ethnic,Fabindia Women White Printed Kurta,46019.jpg
2757,5469,Men,Footwear,Shoes,Sports Shoes,Black,Summer,2011,Sports,Nike Men's Nike Streetgato Black Shoe,5469.jpg
2762,5638,Men,Footwear,Flip Flops,Flip Flops,Brown,Summer,2011,Casual,ADIDAS Men's Adi Liner Brown Flip Flop,5638.jpg
2768,21188,Men,Footwear,Flip Flops,Flip Flops,Black,Summer,2011,Casual,ADIDAS Men Adi Stars Tread Black Flip Flops,21188.jpg
2769,57108,Women,Apparel,Topwear,Tops,White,Summer,2012,Casual,Elle Women White Top,57108.jpg
2770,20866,Unisex,Footwear,Sandal,Sandals,Red,Winter,2012,Casual,Disney Kids-Unisex Diamond Red Sandals,20866.jpg
2771,39177,Women,Apparel,Topwear,Kurtas,Purple,Summer,2012,Ethnic,Aneri Women Purple Printed Kurta,39177.jpg
2773,25528,Women,Apparel,Topwear,Shirts,Navy Blue,Summer,2012,Casual,Wrangler Women Salena Navy Blue Check Shirt,25528.jpg
2774,7953,Men,Apparel,Topwear,Tshirts,Navy Blue,Fall,2011,Casual,Puma Men's Lifestyle Polo Mood Indigo T-shirt,7953.jpg
2775,12198,Men,Apparel,Topwear,Tshirts,Purple,Fall,2011,Casual,Basics Men Solid Purple Tshirts,12198.jpg
2776,19570,Men,Apparel,Topwear,Tshirts,Blue,Fall,2011,Casual,United Colors of Benetton Men Printed Blue TShirt,19570.jpg
2777,6881,Women,Apparel,Topwear,Tops,Peach,Summer,2011,Casual,Forever New Women Sleeveless Peach Top,6881.jpg
2778,46248,Women,Apparel,Topwear,Tops,Teal,Summer,2012,Casual,Fusion Beats Women Teal Top,46248.jpg
2779,16538,Men,Apparel,Topwear,Shirts,White,Fall,2011,Casual,Basics Men White Slim Fit Checked Shirt,16538.jpg
2788,35588,Men,Footwear,Sandal,Sandals,Black,Fall,2012,Casual,Gliders Men Black Sandals,35588.jpg
2789,27871,Women,Apparel,Topwear,Shirts,White,Summer,2012,Casual,Scullers For Her Striped White Shirt,27871.jpg
2791,58372,Men,Apparel,Topwear,Tshirts,Beige,Summer,2012,Casual,Locomotive Men Beige T-shirt,58372.jpg
2795,39345,Men,Apparel,Topwear,Tshirts,Blue,Fall,2012,Casual,Mr. Men Blue T-shirt,39345.jpg
2796,27429,Women,Apparel,Topwear,Tshirts,Pink,Winter,2015,Casual,Jockey Women Pink T-shirt,27429.jpg
2802,23089,Men,Apparel,Bottomwear,Trousers,Beige,Fall,2011,Casual,Arrow Men Beige Trousers,23089.jpg
2803,43950,Women,Footwear,Shoes,Flats,Beige,Winter,2015,Casual,Catwalk Women Beige Shoes,43950.jpg
2808,11977,Men,Footwear,Sandal,Sandals,Olive,Summer,2013,Casual,Fila Men Motor Sports Olive Sandals,11977.jpg
2811,39721,Women,Apparel,Topwear,Tops,Grey,Summer,2012,Casual,Arrow Woman Grey Printed Top,39721.jpg
2814,25970,Women,Apparel,Topwear,Tops,White,Summer,2012,Casual,Femella Women White Top,25970.jpg
2816,33815,Men,Apparel,Bottomwear,Trousers,Black,Summer,2012,Formal,Van Heusen Men Classic Pleated Black Trousers,33815.jpg
2820,11379,Women,Apparel,Topwear,Tops,Blue,Fall,2011,Casual,United Colors Of Benetton Women Winter Blue Top,11379.jpg
2822,44947,Men,Footwear,Shoes,Sports Shoes,White,Summer,2012,Sports,Puma Men Mid Biz Ind White Shoes,44947.jpg
2829,2845,Men,Apparel,Topwear,Tshirts,Blue,Summer,2011,Casual,Mr.Men Men's Mr.Noisy Blue T-shirt,2845.jpg
2830,28653,Men,Footwear,Shoes,Sports Shoes,Black,Summer,2012,Sports,Nike Men Air Max Quarter Black Sports Shoes,28653.jpg
2831,19928,Men,Footwear,Flip Flops,Flip Flops,Yellow,Fall,2011,Casual,ADIDAS Men Adi Wind Yellow Flip Flops,19928.jpg
2832,22369,Men,Apparel,Bottomwear,Trousers,Navy Blue,Fall,2011,Casual,Highlander Men Solid Navy Blue Trouser,22369.jpg
2833,29781,Men,Apparel,Bottomwear,Trousers,Charcoal,Summer,2013,Casual,Basics Men Steel Charcoal Trousers,29781.jpg
2834,3997,Men,Footwear,Flip Flops,Flip Flops,Grey,Winter,2011,Casual,Spalding Men Grey & Orange Flip Flops,3997.jpg
2836,9657,Men,Apparel,Topwear,Shirts,Red,Fall,2011,Casual,Indigo Nation Men Reversible Bling Red Shirts,9657.jpg
2837,23841,Men,Footwear,Shoes,Casual Shoes,White,Fall,2011,Casual,ADIDAS Men White Snipe Lo Casual Shoes,23841.jpg
2842,47538,Women,Footwear,Shoes,Flats,Maroon,Winter,2012,Casual,Portia Women Maroon Flats,47538.jpg
2843,17248,Men,Apparel,Topwear,Tshirts,Navy Blue,Fall,2011,Casual,U.S. Polo Assn. Men Stripes Navy Blue  Polo Tshirt,17248.jpg
2846,29547,Men,Apparel,Topwear,Tshirts,Yellow,Summer,2012,Casual,Classic Polo Men Printed Yellow T-shirt,29547.jpg
2848,11983,Men,Footwear,Shoes,Sports Shoes,Black,Fall,2011,Sports,FILA Men Dls Circuit 2 Black Sports Shoes,11983.jpg
2849,4148,Women,Footwear,Shoes,Sports Shoes,White,Summer,2011,Sports,Nike Women Glide White Pink Shoe,4148.jpg
2851,10851,Men,Apparel,Topwear,Tshirts,Brown,Fall,2011,Casual,Wrangler Men Applique Polo Brown T-Shirts,10851.jpg
2853,4974,Men,Apparel,Topwear,Shirts,Yellow,Summer,2011,Casual,Gini and Jony Boy's Kangaroo Yellow Infant Kidswear,4974.jpg
2854,38607,Men,Apparel,Topwear,Tshirts,Yellow,Summer,2012,Casual,Nike Men Yellow Just Do It T-shirt,38607.jpg
2855,24258,Men,Footwear,Shoes,Casual Shoes,White,Summer,2012,Casual,Numero Uno Men White Casual Shoes,24258.jpg
2857,53138,Women,Footwear,Shoes,Heels,Blue,Winter,2015,Casual,Catwalk Women Blue Heels,53138.jpg
2858,45861,Women,Apparel,Topwear,Kurtas,Maroon,Summer,2012,Ethnic,Vishudh Women Maroon Kurta,45861.jpg
2862,9465,Men,Apparel,Topwear,Shirts,White,Fall,2011,Formal,John Miller Men White Self Structure Shirts,9465.jpg
2863,17846,Men,Footwear,Shoes,Sports Shoes,Black,Fall,2011,Sports,Nike Men Supergame Black Sports Shoe,17846.jpg
2868,16994,Women,Footwear,Shoes,Flats,Black,Winter,2012,Casual,Rocia Women Casual Black Heels,16994.jpg
2869,3963,Women,Apparel,Topwear,Tops,Black,Summer,2011,Casual,Jealous 21 Women Black V Neck Party Top,3963.jpg
2874,20892,Men,Footwear,Shoes,Casual Shoes,Black,Fall,2011,Casual,Basics Men Black Casual Shoes,20892.jpg
2877,39183,Women,Apparel,Topwear,Kurtas,Multi,Summer,2012,Ethnic,Aneri Women Multi Coloured Kurta,39183.jpg
2879,26359,Women,Apparel,Topwear,Tops,Black,Summer,2012,Casual,Arrow Women Black Top,26359.jpg
2880,19584,Men,Apparel,Topwear,Tshirts,Grey,Fall,2011,Casual,United Colors of Benetton Men Stripes Grey Tshirt,19584.jpg
2881,9001,Men,Footwear,Shoes,Casual Shoes,Grey,Fall,2011,Casual,Puma Men El rey Riddim 50s OC Grey Casual Shoes,9001.jpg
2885,12950,Men,Apparel,Topwear,Shirts,White,Fall,2011,Casual,Basics Men White Slim Fit Checked Shirt,12950.jpg
2886,13882,Men,Apparel,Topwear,Shirts,Purple,Fall,2011,Casual,Scullers Men Check Purple Shirts,13882.jpg
2887,6049,Men,Apparel,Topwear,Tshirts,Black,Summer,2011,Casual,UCB Men's Polo Neck T-shirt In Solid Heavy Wash Black T-shirt,6049.jpg
2888,3709,Men,Apparel,Topwear,Tshirts,Purple,Summer,2011,Casual,Classic Polo Men's Purple Black Stripe T-shirt,3709.jpg
2891,9233,Men,Apparel,Topwear,Shirts,Blue,Fall,2011,Formal,Mark Taylor Men Blue Striped Shirt,9233.jpg
2893,29123,Men,Footwear,Shoes,Sports Shoes,White,Summer,2012,Sports,Puma Men Aquil White Sports Shoes,29123.jpg
2895,26957,Women,Apparel,Topwear,Shirts,Purple,Summer,2012,Casual,Jealous 21 Women Purple Shirt,26957.jpg
2896,27885,Women,Apparel,Topwear,Shirts,Blue,Summer,2012,Formal,Scullers For Her Blue Shirt,27885.jpg
2899,1862,Men,Apparel,Topwear,Tshirts,Grey,Summer,2011,Casual,Inkfruit Mens Urban Warfare T-shirt,1862.jpg
2901,10409,Men,Apparel,Topwear,Tshirts,Green,Fall,2011,Casual,United Colors of Benetton Men Green Polo Tshirts,10409.jpg
2903,32759,Men,Apparel,Topwear,Shirts,Purple,Summer,2012,Casual,Indigo Nation Men Striped Purple Shirt,32759.jpg
2905,30693,Women,Footwear,Shoes,Heels,Brown,Winter,2015,Casual,Catwalk Women Brown Heels,30693.jpg
2906,2046,Men,Apparel,Topwear,Tshirts,Blue,Fall,2010,Casual,ADIDAS Mens Fitted Blue T-shirt,2046.jpg
2908,13411,Men,Apparel,Topwear,Shirts,Pink,Summer,2011,Casual,United Colors of Benetton Men Stripes Pink Shirts,13411.jpg
2910,50776,Men,Footwear,Sandal,Sandals,Brown,Winter,2013,Casual,Clarks Men Brown Leather Sandals,50776.jpg
2911,34233,Men,Apparel,Topwear,Tshirts,Mustard,Summer,2013,Casual,Proline Men Mustard Yellow T-shirt,34233.jpg
2912,7534,Men,Apparel,Topwear,Tshirts,White,Summer,2011,Sports,Nike men's As Nike Spher White Orange T-shirt,7534.jpg
2914,46613,Women,Footwear,Shoes,Heels,Grey,Summer,2012,Casual,Catwalk Women Multi Coloured Sandals,46613.jpg
2916,22356,Men,Apparel,Topwear,Shirts,White,Fall,2011,Casual,John Players Men Solid White Shirt,22356.jpg
2923,41436,Men,Footwear,Shoes,Sports Shoes,White,Fall,2012,Casual,Lee Cooper Men Black & White Sports Shoes,41436.jpg
2930,33016,Women,Apparel,Topwear,Kurtas,Black,Summer,2012,Ethnic,Mother Earth Women Striped Black & Maroon Kurta,33016.jpg
2931,4183,Men,Footwear,Shoes,Casual Shoes,Brown,Summer,2011,Casual,Rockport Men Brown Leather Casual Shoes,4183.jpg
2932,11948,Men,Footwear,Shoes,Casual Shoes,Black,Summer,2012,Casual,Ganuchi Men Casual Black Casual Shoes,11948.jpg
2934,58729,Women,Apparel,Topwear,Tshirts,Blue,Summer,2012,Casual,Puma Women Blue T-shirt,58729.jpg
2938,33224,Women,Apparel,Topwear,Tops,Black,Summer,2012,Casual,Sepia Women Striped Black Top,33224.jpg
2943,2274,Men,Apparel,Topwear,Tshirts,White,Fall,2010,Sports,Nike Mens AS White T-shirt,2274.jpg
2945,22958,Men,Footwear,Shoes,Sports Shoes,White,Summer,2012,Sports,Reebok Men White Acciomax Sports Shoes,22958.jpg
2946,49469,Men,Footwear,Shoes,Casual Shoes,Maroon,Summer,2012,Casual,Vans Men Maroon Vulcanized Canvas Shoes,49469.jpg
2949,34001,Women,Apparel,Topwear,Tops,Brown,Summer,2012,Casual,Femella Women Brown Top,34001.jpg
2951,17283,Men,Apparel,Topwear,Tshirts,Brown,Fall,2011,Casual,U.S. Polo Assn. Men Stripes Brown Polo Tshirt,17283.jpg
2952,16351,Men,Apparel,Topwear,Shirts,Cream,Fall,2011,Formal,Peter England Men Stripes Cream Shirt,16351.jpg
2953,22164,Men,Footwear,Shoes,Casual Shoes,Brown,Fall,2012,Casual,Timberland Men Brown Casual Shoes,22164.jpg
2954,7706,Women,Apparel,Topwear,Tops,Black,Fall,2011,Casual,Jealous 21 Women's She's Got Attitude Black Top,7706.jpg
2955,14062,Men,Apparel,Topwear,Tshirts,Grey,Fall,2011,Casual,Flying Machine Men Stripes Grey Polo Tshirts,14062.jpg
2956,20257,Men,Apparel,Topwear,Tshirts,Blue,Fall,2011,Casual,Wrangler Men Wing Blue Tshirt,20257.jpg
2957,5435,Men,Apparel,Topwear,Tshirts,Grey,Summer,2011,Sports,Nike Men's Encourage The Rookies Grey T-shirt,5435.jpg
2958,44712,Men,Footwear,Flip Flops,Flip Flops,Black,Summer,2010,Casual,Lotto Men Black Campione Flip Flop,44712.jpg
2962,57305,Women,Footwear,Shoes,Heels,Black,Winter,2012,Casual,Rocia Women Black Heels,57305.jpg
2963,11510,Women,Footwear,Shoes,Heels,Beige,Winter,2015,Casual,Catwalk Women Lifestyle Beige Flats,11510.jpg
2968,13247,Men,Apparel,Bottomwear,Jeans,Blue,Fall,2011,Casual,Palm Tree Kids Boy Washed Blue Jeans,13247.jpg
2969,54580,Women,Apparel,Topwear,Kurtas,Red,Summer,2012,Ethnic,Sushilas Women Printed Red Kurta,54580.jpg
2970,28806,Men,Apparel,Topwear,Shirts,Black,Summer,2012,Casual,Denizen Men Check Black Shirt,28806.jpg
2971,43537,Women,Apparel,Topwear,Tops,Green,Summer,2012,Casual,French Connection Women Green Top,43537.jpg
2972,2610,Women,Footwear,Shoes,Heels,Black,Winter,2012,Casual,Carlton London Women Stylish Black Flats,2610.jpg
2973,16735,Men,Footwear,Flip Flops,Flip Flops,Black,Fall,2011,Casual,Lotto Men Emeriti Black Slipper,16735.jpg
2974,49831,Women,Footwear,Flip Flops,Flip Flops,Blue,Winter,2012,Casual,iPanema Women Blue Flip Flops,49831.jpg
2975,22500,Women,Footwear,Shoes,Casual Shoes,Blue,Winter,2015,Casual,Catwalk Women Blue Casual Shoes,22500.jpg
2976,7362,Women,Apparel,Topwear,Tops,Blue,Summer,2011,Casual,UCB Women's Graphic Print Sequins Blue Top,7362.jpg
2978,47197,Men,Footwear,Sandal,Sandals,Black,Summer,2010,Casual,Franco Leone Men Black Sandals,47197.jpg
2980,31325,Women,Apparel,Topwear,Kurtas,Purple,Summer,2012,Ethnic,Aurelia Women Printed Purple Kurta,31325.jpg
2983,13075,Men,Footwear,Shoes,Casual Shoes,Black,Summer,2013,Casual,Numero Uno Men Black Shoes,13075.jpg
