id,gender,masterCategory,subCategory,articleType,baseColour,season,year,usage,productDisplayName,image
978,26536,Men,Footwear,Shoes,Casual Shoes,White,Summer,2012,Casual,ID Men White Shoes,26536.jpg
979,12703,Women,Footwear,Shoes,Sports Shoes,White,Fall,2011,Sports,Nike Women Downshifter White Sports Shoes,12703.jpg
981,10430,Men,Apparel,Topwear,Shirts,Blue,Fall,2011,Casual,Flying Machine Men Ydc Blue Shirts,10430.jpg
983,39388,Men,Apparel,Bottomwear,Jeans,Black,Summer,2012,Casual,Peter England Men Black Jeans,39388.jpg
984,14090,Men,Apparel,Topwear,Tshirts,Blue,Fall,2011,Casual,Flying Machine Men Stripes Blue Polo Tshirts,14090.jpg
985,53757,Women,Footwear,Shoes,Sports Shoes,White,Summer,2012,Sports,Puma Women Speeder Wns Ind White Sports Shoes,53757.jpg
986,37212,Men,Apparel,Topwear,Shirts,Pink,Summer,2012,Casual,United Colors of Benetton Men Pink Shirt,37212.jpg
987,4515,Men,Footwear,Shoes,Sports Shoes,White,Summer,2011,Sports,Puma Men's Tarun White Silver Red Shoe,4515.jpg
992,6242,Women,Apparel,Topwear,Tshirts,Purple,Summer,2011,Casual,Lee Women's Rihana Purple T-shirt,6242.jpg
998,3730,Men,Apparel,Topwear,Tshirts,Yellow,Summer,2011,Sports,CSK Mens Fangear Yellow Jersey,3730.jpg
999,26152,Men,Apparel,Bottomwear,Trousers,Grey,Summer,2012,Formal,John Miller Men Striped Grey Trousers,26152.jpg
1000,12367,Men,Apparel,Topwear,Shirts,White,Fall,2011,Formal,Reid & Taylor Men White Shirt,12367.jpg
1001,54572,Women,Apparel,Topwear,Kurtas,Pink,Summer,2012,Ethnic,Sushilas Women Multi Coloured Kurta,54572.jpg
1002,27080,Women,Footwear,Shoes,Heels,Silver,Winter,2015,Casual,Catwalk Women Silver Flats,27080.jpg
1005,12969,Men,Footwear,Shoes,Sports Shoes,Blue,Fall,2011,Sports,ADIDAS Men Snova Glide Blue Sports Shoes,12969.jpg
1006,35777,Men,Footwear,Shoes,Sports Shoes,Black,Summer,2012,Sports,Force 10 Men Black & Green Sports Shoes,35777.jpg
1007,51232,Women,Apparel,Topwear,Kurtas,Green,Fall,2012,Ethnic,Satya Paul Women Green Printed Kaftan,51232.jpg
1009,9804,Men,Apparel,Topwear,Shirts,Black,Fall,2011,Formal,John Miller Men Black Checks Shirts,9804.jpg
1011,6070,Women,Apparel,Topwear,Tshirts,Blue,Summer,2011,Casual,UCB Women's Young Pigment Blue T-shirt,6070.jpg
1013,26360,Women,Apparel,Topwear,Tshirts,Grey,Summer,2012,Casual,Arrow Woman Grey T-shirt,26360.jpg
1016,3502,Women,Apparel,Topwear,Tshirts,Black,Fall,2010,Sports,ADIDAS Women's Black T-shirt,3502.jpg
1020,13087,Unisex,Footwear,Shoes,Casual Shoes,Brown,Fall,2011,Casual,Timberland Unisex Casual Brown Casual Shoes,13087.jpg
1021,10602,Men,Apparel,Topwear,Tshirts,Red,Fall,2011,Sports,Nike Men Football Soccer Red Jerseys,10602.jpg
1025,32552,Men,Footwear,Shoes,Casual Shoes,Black,Summer,2013,Casual,Playboy Men Black Shoes,32552.jpg
1028,20097,Women,Apparel,Topwear,Kurtas,White,Fall,2011,Ethnic,Diva Women Printed White Kurta,20097.jpg
1031,39986,Men,Footwear,Shoes,Casual Shoes,Navy Blue,Summer,2013,Casual,Gas Men Mila Navy Blue Shoes,39986.jpg
1032,21145,Women,Apparel,Topwear,Shirts,Black,Fall,2011,Casual,s.Oliver Women Printed Black Shirt,21145.jpg
1034,45400,Women,Footwear,Shoes,Flats,Maroon,Winter,2012,Casual,Rocia Women Maroon Sandals,45400.jpg
1040,59403,Women,Apparel,Topwear,Tshirts,White,Fall,2012,Casual,Tokyo Talkies Women White T-shirt,59403.jpg
1042,53139,Women,Footwear,Shoes,Heels,Blue,Winter,2015,Casual,Catwalk Women Blue & White Sandals,53139.jpg
1043,29774,Men,Apparel,Topwear,Shirts,Purple,Summer,2012,Casual,Wrangler Men Purple Striped Shirt,29774.jpg
1044,3962,Women,Apparel,Topwear,Tops,Black,Summer,2011,Casual,Jealous 21 Women Black Shimmery Falling Neck Top,3962.jpg
1046,17847,Men,Footwear,Shoes,Sports Shoes,White,Summer,2012,Sports,Nike Men Air Impetus II White Sports Shoe,17847.jpg
1047,9464,Men,Apparel,Topwear,Shirts,White,Fall,2011,Formal,John Miller Men  White Shirt,9464.jpg
1051,17249,Men,Apparel,Topwear,Tshirts,Blue,Fall,2011,Casual,U.S. Polo Assn. Men Printed Limoges Blue Tshirt,17249.jpg
1052,47539,Women,Footwear,Shoes,Flats,White,Winter,2012,Casual,Portia Women White Flats,47539.jpg
1053,29546,Men,Apparel,Topwear,Tshirts,Black,Summer,2012,Casual,Classic Polo Men Black T-shirt,29546.jpg
1055,9656,Men,Apparel,Topwear,Shirts,Maroon,Fall,2011,Casual,Indigo Nation Men Bling Technification Red Black Shirts,9656.jpg
1056,23840,Men,Footwear,Shoes,Casual Shoes,Brown,Fall,2011,Casual,ADIDAS Men Brown Shoes,23840.jpg
1061,4975,Men,Apparel,Topwear,Tshirts,Red,Summer,2011,Casual,Gini and Jony Boy's Kent Pack of 3 Tee Kidswear,4975.jpg
1062,56679,Women,Footwear,Shoes,Heels,Brown,Winter,2012,Casual,Portia Women Brown Sandals,56679.jpg
1063,24259,Men,Footwear,Shoes,Casual Shoes,Navy Blue,Fall,2012,Casual,Numero Uno Men Navy Blue Shoes,24259.jpg
1064,38606,Men,Apparel,Topwear,Tshirts,White,Summer,2012,Casual,Nike Men Printed Boxed White T-shirt,38606.jpg
1066,4149,Women,Footwear,Shoes,Sports Shoes,White,Summer,2011,Sports,Nike Women Free White Pink Shoe,4149.jpg
1067,10850,Men,Apparel,Topwear,Tshirts,Blue,Fall,2011,Casual,Wrangler Men Famous Filafil Blue T-Shirts,10850.jpg
1068,26956,Women,Apparel,Topwear,Tops,Black,Summer,2012,Casual,Jealous 21 Women Black Top,26956.jpg
1071,30833,Women,Apparel,Topwear,Kurtas,Beige,Summer,2012,Ethnic,Fabindia Women Beige Kurta,30833.jpg
1073,27884,Women,Apparel,Topwear,Shirts,Blue,Summer,2012,Formal,Scullers For Her Blue Shirt,27884.jpg
1075,3708,Men,Apparel,Topwear,Tshirts,Navy Blue,Summer,2011,Casual,Classic Polo Men's Navy Grey Stripe T-shirt,3708.jpg
1077,18665,Men,Footwear,Shoes,Casual Shoes,White,Summer,2013,Casual,Fila Men Syncro White Shoes,18665.jpg
1079,10408,Women,Apparel,Topwear,Tops,Black,Fall,2011,Casual,United Colors of Benetton Women Solid Black Tops,10408.jpg
1082,1863,Men,Apparel,Topwear,Tshirts,Black,Summer,2011,Casual,Inkfruit Men Night Wolf T-shirt,1863.jpg
1084,20893,Men,Footwear,Shoes,Casual Shoes,Black,Fall,2011,Casual,Basics Men Black Casual Shoes,20893.jpg
1087,39182,Women,Apparel,Topwear,Kurtas,Magenta,Summer,2012,Ethnic,Aneri Women Magenta & Black Kurta,39182.jpg
1088,41098,Women,Apparel,Topwear,Tops,Cream,Summer,2012,Casual,Allen Solly Woman Cream Top,41098.jpg
1092,15348,Men,Apparel,Topwear,Tshirts,Black,Fall,2011,Casual,Nike Men Special Edition 3 Star Polo Black Tshirts,15348.jpg
1093,12951,Men,Apparel,Topwear,Shirts,Blue,Fall,2011,Casual,Basics Men Blue Slim Fit Checked Shirt,12951.jpg
1094,6048,Men,Apparel,Topwear,Shirts,Black,Summer,2011,Casual,UCB Men Ben Logo Black Shirt,6048.jpg
1095,13883,Men,Apparel,Topwear,Shirts,Purple,Fall,2011,Casual,Scullers Men Check Purple Shirts,13883.jpg
1096,19585,Women,Apparel,Topwear,Tops,Blue,Summer,2011,Casual,United Colors of Benetton Women Solid Blue Top,19585.jpg
1099,9000,Men,Footwear,Shoes,Casual Shoes,Brown,Fall,2011,Casual,Puma Men Archive Boot WTR Brown Casual Shoes,9000.jpg
1101,35589,Men,Footwear,Sandal,Sandals,Olive,Fall,2012,Casual,Gliders Men Yellow Sandals,35589.jpg
1107,8314,Men,Apparel,Topwear,Shirts,Blue,Summer,2011,Casual,Locomotive Men Check Lafayette Blue Shirts,8314.jpg
1114,39344,Men,Apparel,Topwear,Tshirts,Green,Fall,2012,Casual,Mr. Men Green T-shirt,39344.jpg
1115,1897,Men,Apparel,Topwear,Tshirts,Blue,Winter,2010,Sports,FIFA Men Germany Blue Jersey,1897.jpg
1119,25529,Men,Apparel,Topwear,Shirts,White,Summer,2012,Casual,Wrangler Men Griffith White Shirt,25529.jpg
1120,39176,Women,Apparel,Topwear,Kurtas,Purple,Summer,2012,Ethnic,Aneri Women Purple Kurta,39176.jpg
1127,16539,Men,Apparel,Topwear,Shirts,White,Fall,2011,Casual,Basics Men White Slim Fit Striped Shirt,16539.jpg
1129,13877,Men,Apparel,Topwear,Shirts,Maroon,Fall,2011,Casual,Scullers Men Solid Maroon Shirts,13877.jpg
1132,19571,Men,Apparel,Topwear,Tshirts,Black,Summer,2011,Casual,United Colors of Benetton Men Printed Black TShirt,19571.jpg
1133,12199,Men,Apparel,Topwear,Tshirts,Blue,Summer,2015,Casual,Basics Men Blue Polo T-shirt,12199.jpg
1134,7952,Men,Apparel,Topwear,Tshirts,Black,Fall,2011,Sports,Puma Men's Knit Polo Black  Polo T-shirt,7952.jpg
1136,11378,Men,Apparel,Topwear,Shirts,White,Fall,2011,Formal,United Colors of Benetton Men Summer White Shirts,11378.jpg
1140,41408,Women,Apparel,Topwear,Tops,Red,Summer,2012,Casual,Wrangler Women Red Stay Gold Tee Top,41408.jpg
1141,33028,Women,Apparel,Topwear,Kurtas,Blue,Summer,2012,Ethnic,Mother Earth Women Printed Blue Kurta,33028.jpg
1145,2844,Men,Apparel,Topwear,Tshirts,Navy Blue,Summer,2011,Casual,Mr.Men Men's Mr.Busy Navy T-shirt,2844.jpg
1147,28652,Men,Footwear,Shoes,Sports Shoes,Black,Summer,2012,Sports,Nike Men Tiempo Natural IV Black Sports Shoes,28652.jpg
1148,29780,Men,Apparel,Bottomwear,Trousers,Black,Summer,2013,Casual,Basics Men Black Trousers,29780.jpg
1149,22368,Men,Apparel,Topwear,Tshirts,Peach,Fall,2011,Casual,Ed Hardy Men Diving Dragon Peach T-Shirt,22368.jpg
1150,3996,Men,Footwear,Flip Flops,Flip Flops,Black,Summer,2011,Casual,Spalding Men Black Flip Flops,3996.jpg
1152,2078,Women,Apparel,Topwear,Tshirts,Black,Fall,2010,Sports,ADIDAS Women Fitted Black T-shirt,2078.jpg
1155,8542,Women,Footwear,Flip Flops,Flip Flops,Black,Fall,2011,Casual,Crocs Women Abf Single Flip Slippers,8542.jpg
1159,23088,Men,Apparel,Bottomwear,Trousers,Grey,Fall,2011,Casual,Arrow Sport Men Dk.Grey Brown Trousers,23088.jpg
1160,43951,Women,Footwear,Shoes,Heels,Bronze,Winter,2012,Casual,Catwalk Women Bronze Heels,43951.jpg
1165,27428,Women,Apparel,Topwear,Tshirts,Black,Fall,2015,Casual,Jockey Women Black V-neck T-Shirt,27428.jpg
1172,11976,Men,Footwear,Shoes,Casual Shoes,Black,Summer,2013,Casual,Fila Men Paramount Plus Black Shoes,11976.jpg
1174,44348,Men,Apparel,Topwear,Shirts,Brown,Summer,2012,Casual,Indian Terrain Men Brown Check Shirt,44348.jpg
1175,14438,Women,Footwear,Shoes,Heels,Yellow,Summer,2012,Casual,Enroute Women Casual Yellow Heels,14438.jpg
1181,3505,Women,Footwear,Shoes,Casual Shoes,White,Fall,2010,Casual,ADIDAS Women Adi Light White Fresh Shoe,3505.jpg
1186,13080,Men,Footwear,Shoes,Casual Shoes,Black,Summer,2013,Casual,Numero Uno Men Black Casual Shoes,13080.jpg
1189,33487,Men,Apparel,Topwear,Shirts,Red,Summer,2012,Casual,Doodle Kids Boy Check Red Shirt,33487.jpg
1193,32555,Men,Footwear,Shoes,Casual Shoes,White,Summer,2013,Casual,Playboy Men White Shoes,32555.jpg
1196,45407,Women,Footwear,Shoes,Flats,Brown,Summer,2012,Casual,Rocia Women Brown Sandals,45407.jpg
1198,21142,Women,Apparel,Topwear,Tops,Grey,Fall,2011,Casual,s.Oliver Women Grey Top,21142.jpg
1199,39981,Men,Footwear,Shoes,Casual Shoes,Grey,Summer,2013,Casual,Gas Men Jack Grey Shoes,39981.jpg
1201,15377,Men,Footwear,Shoes,Casual Shoes,Navy Blue,Summer,2012,Casual,Fila Men Lobato Navy Blue Casual Shoes,15377.jpg
1202,10437,Men,Apparel,Topwear,Shirts,Green,Fall,2011,Casual,Flying Machine Men HS Green Shirts,10437.jpg
1203,24602,Women,Apparel,Topwear,Kurtas,Blue,Fall,2011,Ethnic,BIba Women Blue Printed Kurta,24602.jpg
1204,32767,Men,Apparel,Topwear,Shirts,White,Summer,2012,Formal,John Miller Men Striped White Shirt,32767.jpg
1206,37215,Men,Apparel,Topwear,Shirts,Grey,Summer,2012,Casual,United Colors of Benetton Men Grey Shirt,37215.jpg
1207,14097,Men,Apparel,Topwear,Tshirts,Blue,Fall,2011,Casual,Flying Machine Men Blue Polo Tshirts,14097.jpg
1210,15145,Men,Apparel,Topwear,Shirts,Navy Blue,Fall,2011,Casual,Arrow Sport Men Printed Navy Blue Shirts,15145.jpg
1212,4512,Women,Footwear,Shoes,Sports Shoes,Grey,Summer,2011,Sports,Lotto Women Osaka Grey Violet Shoe,4512.jpg
1215,26969,Women,Apparel,Topwear,Tops,White,Summer,2012,Casual,Jealous 21 Women Printed White & Blue Top,26969.jpg
1220,6245,Men,Apparel,Topwear,Tshirts,Grey,Summer,2011,Casual,UCB Men's Contrast Logo Grey T-shirt,6245.jpg
1222,12360,Men,Apparel,Topwear,Shirts,Black,Fall,2011,Formal,Reid & Taylor Men Solid Black Shirts,12360.jpg
1223,26155,Men,Apparel,Bottomwear,Trousers,Grey,Summer,2012,Formal,John Miller Men Striped Grey Trousers,26155.jpg
1227,27087,Women,Apparel,Topwear,Kurtas,Black,Summer,2012,Ethnic,Aneri Women Egyptian Black Kurta,27087.jpg
1228,54575,Women,Apparel,Topwear,Kurtas,Maroon,Summer,2012,Ethnic,Sushilas Women Printed Maroon Kurta,54575.jpg
1231,5898,Men,Footwear,Shoes,Casual Shoes,Blue,Summer,2011,Casual,Puma Men Tekkies Jam Blue Shoe,5898.jpg
1233,10053,Women,Apparel,Topwear,Tshirts,Pink,Summer,2011,Casual,Gini And Jony Vini Romper Pink T-Shirts,10053.jpg
1234,24266,Men,Apparel,Topwear,Tshirts,Red,Summer,2012,Casual,Quiksilver Men Red T-shirt,24266.jpg
1235,38639,Men,Apparel,Topwear,Tshirts,Blue,Summer,2012,Casual,Nike Men Blue Cricket Blue Polo Tshirt,38639.jpg
1236,15521,Men,Footwear,Flip Flops,Flip Flops,Black,Fall,2011,Casual,Rockport Men Jelbalp Black Flip Flops,15521.jpg
1241,17276,Men,Apparel,Topwear,Tshirts,Mustard,Fall,2011,Casual,U.S. Polo Assn. Men Printed Mustard Tshirt,17276.jpg
1243,6621,Men,Footwear,Shoes,Sports Shoes,Black,Summer,2011,Sports,ADIDAS Men's Boris Black Shoe,6621.jpg
1244,51463,Women,Apparel,Topwear,Tops,Black,Summer,2012,Casual,Tonga Women Black Top,51463.jpg
1246,22191,Men,Footwear,Shoes,Casual Shoes,Brown,Fall,2012,Casual,Timberland Men Light Brown Casual Shoes,22191.jpg
1247,9669,Men,Apparel,Topwear,Shirts,Blue,Fall,2011,Casual,Indigo Nation Men Checks Blue Shirts,9669.jpg
1248,54111,Women,Footwear,Shoes,Heels,Copper,Winter,2012,Casual,Rocia Women Copper Flats,54111.jpg
1249,12704,Men,Footwear,Shoes,Sports Shoes,Grey,Fall,2011,Sports,Nike Men Air Relentness Grey Sports Shoes,12704.jpg
1250,26531,Men,Footwear,Shoes,Casual Shoes,Olive,Summer,2013,Casual,Gas Men Arunta Olive Casual Shoes,26531.jpg
1251,31586,Men,Apparel,Topwear,Tshirts,Yellow,Summer,2012,Casual,Mark Taylor Men Printed Yellow T-shirt,31586.jpg
1252,3353,Men,Apparel,Topwear,Tshirts,Blue,Summer,2011,Casual,Myntra Men's I am a nice guy Navy Blue T-shirt,3353.jpg
1255,6413,Unisex,Footwear,Shoes,Casual Shoes,Pink,Summer,2011,Casual,Lotto Unisex Canvas Pink Shoe,6413.jpg
1257,28699,Women,Apparel,Topwear,Kurtas,Pink,Summer,2012,Ethnic,W Women Printed  Light Pink Kurta,28699.jpg
1259,17044,Men,Footwear,Sandal,Sandals,Brown,Summer,2013,Casual,Gas Men Aventura Sandal,17044.jpg
1260,50783,Women,Footwear,Shoes,Heels,Black,Winter,2015,Casual,Clarks Women Black Onslow Beat Leather Wedges,50783.jpg
1267,3161,Men,Footwear,Shoes,Sports Shoes,White,Summer,2011,Sports,Nike Men's Air Citius MSL White Grey Shoe,3161.jpg
1268,8589,Men,Apparel,Topwear,Shirts,Blue,Fall,2011,Casual,Scullers Men Scul Blue Shirts,8589.jpg
1270,26703,Men,Footwear,Shoes,Sports Shoes,White,Fall,2011,Sports,Nike Men White Court Shuttle Shoes,26703.jpg
1273,1636,Men,Footwear,Shoes,Sports Shoes,White,Fall,2010,Sports,Nike Men Air Zoom Century Shoes,1636.jpg
1275,10261,Men,Apparel,Bottomwear,Trousers,Brown,Fall,2011,Formal,John Miller Men Slim Brown Trousers,10261.jpg
1276,24054,Men,Apparel,Topwear,Tshirts,Blue,Fall,2011,Casual,Locomotive Men Printed Blue T-shirt,24054.jpg
1277,4344,Men,Footwear,Shoes,Sports Shoes,White,Summer,2011,Sports,Fila Men's Abascuss White Blue Shoe,4344.jpg
1279,15713,Men,Footwear,Shoes,Sports Shoes,Black,Fall,2011,Sports,Nike Men Air Relentless Black Sports Shoes,15713.jpg
1281,5296,Men,Footwear,Sandal,Sandals,Black,Summer,2011,Casual,Puma Men Black Floater,5296.jpg
1283,41605,Men,Apparel,Topwear,Shirts,Grey,Fall,2012,Casual,Basics Men Grey Shirt,41605.jpg
1289,11949,Men,Footwear,Shoes,Casual Shoes,Brown,Fall,2012,Casual,Ganuchi Men Casual Brown Casual Shoes,11949.jpg
1292,5050,Men,Footwear,Shoes,Casual Shoes,Black,Summer,2011,Casual,Fila Men's Passion Black red Canvas Shoe,5050.jpg
1294,58728,Women,Apparel,Topwear,Tshirts,Pink,Summer,2012,Casual,Puma Women Pink T-shirt,58728.jpg
1296,17282,Men,Apparel,Topwear,Tshirts,Black,Fall,2011,Casual,U.S. Polo Assn. Men Printed Black Tshirt,17282.jpg
1297,34000,Women,Apparel,Topwear,Tops,Black,Summer,2012,Casual,Femella Women Black Top,34000.jpg
1298,7707,Women,Apparel,Bottomwear,Jeans,Black,Fall,2011,Casual,Jealous 21 Women's Abbie Black Jegging,7707.jpg
1300,16350,Men,Apparel,Topwear,Shirts,Cream,Fall,2011,Formal,Peter England Men Stripes Cream Shirt,16350.jpg
1301,51497,Women,Apparel,Bottomwear,Jeans,Navy Blue,Summer,2012,Casual,Denizen Women Navy Blue Jeans,51497.jpg
1302,22165,Men,Footwear,Shoes,Casual Shoes,Brown,Fall,2012,Casual,Timberland Men Brown Casual Shoes,22165.jpg
1304,2275,Men,Apparel,Topwear,Tshirts,White,Fall,2010,Sports,Nike Mens Challenger Graphic White T-shirt,2275.jpg
1308,49468,Men,Footwear,Shoes,Casual Shoes,Red,Summer,2012,Casual,Vans Men Red Old Skool Shoes,49468.jpg
1310,22959,Men,Footwear,Shoes,Sports Shoes,White,Summer,2012,Sports,Reebok Men White Fusion Sports Shoes,22959.jpg
1311,34232,Men,Apparel,Topwear,Tshirts,Grey,Summer,2013,Casual,Proline Men Grey T-shirt,34232.jpg
1314,16162,Men,Footwear,Sandal,Sandals,Black,Fall,2011,Casual,Enroute Men Leather Black Sandals,16162.jpg
1315,22357,Men,Apparel,Topwear,Shirts,Black,Fall,2011,Casual,John Players Men Solid Black Shirt,22357.jpg
1317,7535,Men,Apparel,Topwear,Tshirts,Blue,Summer,2011,Sports,Nike Men's Blue Polo T-shirt,7535.jpg
1318,46612,Women,Footwear,Shoes,Heels,Brown,Winter,2012,Casual,Catwalk Women Brown Wedges,46612.jpg
1320,13410,Men,Apparel,Topwear,Shirts,Blue,Summer,2011,Casual,United Colors of Benetton Men Solid Blue Shirts,13410.jpg
1322,43360,Men,Footwear,Shoes,Sports Shoes,White,Summer,2012,Sports,Reebok Men White Ultimate Vibe Sports Shoes,43360.jpg
1323,2047,Men,Apparel,Topwear,Tshirts,Navy Blue,Fall,2010,Sports,ADIDAS Men's Navy Blue T-shirt,2047.jpg
1324,30692,Women,Footwear,Shoes,Heels,Brown,Winter,2015,Casual,Catwalk Women Brown Heels,30692.jpg
1329,41437,Men,Footwear,Shoes,Sports Shoes,White,Fall,2012,Sports,Lee Cooper Men White Sports Shoes,41437.jpg
1330,33017,Women,Apparel,Topwear,Kurtas,Green,Summer,2012,Ethnic,Mother Earth Women Striped Green Kurta,33017.jpg
1339,16506,Men,Apparel,Bottomwear,Jeans,Blue,Fall,2011,Casual,Locomotive Men Washed Blue Jeans,16506.jpg
1340,22733,Men,Footwear,Shoes,Casual Shoes,Grey,Fall,2011,Casual,Nike Men Dunk High Grey Casual Shoes,22733.jpg
1341,35784,Women,Footwear,Shoes,Flats,Black,Summer,2012,Casual,Enroute Women Black Shoes,35784.jpg
1342,7151,Women,Apparel,Topwear,Shirts,Black,Fall,2011,Casual,Scullers For Her Women Rivited Check Black Shirts,7151.jpg
1343,46276,Women,Apparel,Topwear,Tops,Cream,Summer,2012,Casual,109F Women Cream Printed Top,46276.jpg
1344,13848,Men,Apparel,Topwear,Tshirts,Blue,Fall,2011,Casual,United Colors of Benetton Men Solid Blue Polo Tshirts,13848.jpg
1345,6083,Women,Apparel,Topwear,Tshirts,Pink,Summer,2011,Casual,UCB Women's Halftone Print Pink T-shirt,6083.jpg
1349,31324,Women,Apparel,Topwear,Kurtas,Blue,Summer,2012,Ethnic,Aurelia Women Printed Blue Kurta,31324.jpg
1350,13074,Men,Footwear,Shoes,Casual Shoes,Brown,Fall,2011,Casual,Numero Uno Men Brown Casual Shoes,13074.jpg
1356,57136,Women,Apparel,Bottomwear,Trousers,Black,Summer,2012,Casual,Elle Women Black Trousers,57136.jpg
1358,39149,Women,Apparel,Topwear,Kurtas,Red,Summer,2012,Ethnic,Aneri Women Red Kurtas,39149.jpg
1362,5606,Men,Footwear,Sandal,Sandals,Black,Summer,2011,Casual,ADIDAS Men Kendall Black Floater,5606.jpg
1363,44521,Men,Footwear,Sandal,Sandals,Black,Summer,2012,Casual,Coolers Men Black Sandals,44521.jpg
1367,57304,Women,Footwear,Shoes,Heels,Brown,Winter,2012,Casual,Rocia Women Brown Wedges,57304.jpg
1368,33641,Men,Footwear,Flip Flops,Flip Flops,Black,Summer,2012,Casual,Lotto Men Black Koro G Slippers,33641.jpg
1371,11511,Women,Footwear,Shoes,Flats,Gold,Winter,2015,Casual,Catwalk Women Lifestyle Gold Toned Ballerinas,11511.jpg
1372,5434,Men,Apparel,Topwear,Tshirts,Red,Summer,2011,Sports,Nike Men's Kill Man Red T-shirt,5434.jpg
1373,44713,Men,Footwear,Flip Flops,Flip Flops,Black,Summer,2012,Casual,Lotto Men Black Flip Flops,44713.jpg
1374,14063,Men,Apparel,Topwear,Tshirts,Blue,Fall,2011,Casual,Flying Machine Men Solid Blue Polo Tshirts,14063.jpg
1375,20256,Men,Apparel,Topwear,Tshirts,Green,Fall,2011,Casual,Wrangler Men Wing Green T-shirt,20256.jpg
1380,16734,Men,Footwear,Flip Flops,Flip Flops,Maroon,Fall,2011,Casual,Lotto Men Emeriti Maroon Slipper,16734.jpg
1381,22501,Women,Footwear,Shoes,Casual Shoes,Beige,Winter,2015,Casual,Catwalk Women Beige Casual Shoes,22501.jpg
1382,49830,Women,Footwear,Flip Flops,Flip Flops,Pink,Winter,2012,Casual,iPanema Women Pink Flip Flops,49830.jpg
1383,47196,Men,Footwear,Sandal,Sandals,Brown,Summer,2012,Casual,Franco Leone Men Brown Sandals,47196.jpg
1388,43536,Women,Apparel,Topwear,Tops,Peach,Summer,2012,Casual,French Connection Women Peach Top,43536.jpg
1389,28807,Men,Apparel,Topwear,Shirts,Brown,Summer,2012,Casual,Denizen Men Check Brown Shirt,28807.jpg
1390,2611,Women,Footwear,Shoes,Heels,Gold,Winter,2012,Casual,Carlton London Women Stylish Gold Flats,2611.jpg
1391,13246,Men,Apparel,Bottomwear,Jeans,Blue,Fall,2011,Casual,Palm Tree Kids Boy Washed Blue Jeans,13246.jpg
1392,54581,Women,Apparel,Topwear,Kurtas,Green,Summer,2012,Ethnic,Sushilas Women Printed Green Kurta,54581.jpg
1393,3763,Men,Apparel,Topwear,Tshirts,Grey,Summer,2011,Casual,Status Quo Men's London Icon Grey T-shirt,3763.jpg
1395,26101,Men,Apparel,Topwear,Shirts,White,Summer,2012,Formal,John Miller Men Striped White Shirt,26101.jpg
1396,54521,Men,Footwear,Shoes,Sports Shoes,White,Fall,2012,Sports,F Sports Men White Voyager Sports Shoes,54521.jpg
1397,9259,Men,Apparel,Topwear,Shirts,Blue,Fall,2011,Formal,Mark Taylor Men Blue Striped Shirt,9259.jpg
1399,16794,Men,Apparel,Topwear,Shirts,Navy Blue,Fall,2011,Casual,Highlander Men Stripes Navy Blue Shirt,16794.jpg
1403,6211,Women,Apparel,Topwear,Tshirts,Blue,Summer,2011,Casual,UCB Women's Print Boat Blue Top,6211.jpg
1408,30858,Women,Apparel,Topwear,Kurtas,Black,Summer,2012,Ethnic,Fabindia Women Striped Black Kurta,30858.jpg
1410,37241,Men,Footwear,Shoes,Casual Shoes,Black,Summer,2012,Casual,United Colors of Benetton Men Black Shoes,37241.jpg
1411,5494,Men,Apparel,Topwear,Tshirts,Grey,Summer,2011,Casual,Mr.Men Men's Charcoal Polo T-shirt,5494.jpg
1414,4546,Men,Footwear,Shoes,Sports Shoes,Black,Summer,2011,Sports,Nike Men's Air Max Black Shoe,4546.jpg
1416,15111,Men,Apparel,Bottomwear,Trousers,Coffee Brown,Fall,2011,Formal,Arrow Men Stripes Coffee Brown Trousers,15111.jpg
1418,40313,Unisex,Footwear,Sandal,Sandals,White,Winter,2013,Casual,Warner Bros Kids White sandals,40313.jpg
1419,10463,Men,Apparel,Topwear,Tshirts,Grey,Fall,2011,Casual,Flying Machine Men Grey Polo Tshirts,10463.jpg
1426,21116,Women,Apparel,Topwear,Tops,Lavender,Fall,2011,Casual,s.Oliver Women Faded Lilac Top,21116.jpg
1428,56878,Women,Footwear,Shoes,Heels,Silver,Winter,2012,Casual,HM Women Silver Heels,56878.jpg
1432,32501,Men,Apparel,Topwear,Shirts,Black,Summer,2012,Casual,Scullers Men Black Shirt,32501.jpg
1434,11783,Men,Apparel,Topwear,Tshirts,Grey,Summer,2011,Casual,Lee Men Printed Grey Tshirts,11783.jpg
1437,3551,Men,Footwear,Shoes,Casual Shoes,Brown,Winter,2015,Casual,Skechers Men's Charcoal Lifestyle Shoe,3551.jpg
1438,42676,Women,Apparel,Topwear,Kurtas,Black,Summer,2012,Ethnic,Alma Women Black Kurta,42676.jpg
1439,2483,Women,Apparel,Topwear,Tops,Purple,Fall,2011,Casual,Puma Women Spagetti Dahlia Purple Top,2483.jpg
1443,9857,Men,Apparel,Topwear,Tshirts,Green,Fall,2011,Casual,Status Quo Men Green Polo Tshirts,9857.jpg
1445,6023,Men,Apparel,Topwear,Tshirts,Green,Summer,2011,Casual,UCB Men's Johny Collar With Two Tone Green T-shirt,6023.jpg
1448,32959,Men,Apparel,Topwear,Tshirts,Purple,Summer,2012,Casual,Angry Birds Men Purple T-shirt,32959.jpg
1449,52080,Men,Apparel,Topwear,Tshirts,Navy Blue,Summer,2012,Casual,Myntra Men Navy Blue T-shirt,52080.jpg
1452,4310,Unisex,Apparel,Topwear,Tshirts,Green,Summer,2011,Casual,Tantra Kid's Unisex Papa's Joy Green Kidswear,4310.jpg
1454,53152,Men,Apparel,Topwear,Shirts,Brown,Summer,2012,Formal,Mark Taylor Men Brown Shirt,53152.jpg
1455,14695,Men,Apparel,Bottomwear,Trousers,Black,Fall,2011,Casual,Basics Men Black Trousers,14695.jpg
1462,30632,Men,Apparel,Topwear,Tshirts,Yellow,Summer,2012,Sports,Nike Men Challenger Spiked Yellowish Green T-shirt,30632.jpg
1465,3135,Women,Footwear,Shoes,Heels,Gold,Winter,2015,Casual,Catwalk Women Heeded Golden Strap Black Heels,3135.jpg
1467,23225,Women,Apparel,Topwear,Kurtas,Pink,Fall,2011,Ethnic,Aneri Women Tibett Pink Kurta,23225.jpg
1468,17010,Women,Footwear,Shoes,Heels,Brown,Winter,2012,Formal,Rocia Women Brown Heels,17010.jpg
1471,6447,Women,Footwear,Flip Flops,Flip Flops,Black,Summer,2011,Casual,Lotto Women's Cross Color Black Pink Flip Flop,6447.jpg
1472,7595,Women,Footwear,Shoes,Sports Shoes,Blue,Summer,2011,Sports,Nike Women Ten Blue White Shoe,7595.jpg
1474,51605,Women,Apparel,Bottomwear,Trousers,Black,Fall,2012,Casual,Kraus Jeans Women Black Trousers,51605.jpg
1475,13682,Women,Footwear,Shoes,Sports Shoes,Silver,Fall,2011,Sports,ADIDAS Women Duramo 3 Sports Shoes,13682.jpg
1478,42020,Men,Footwear,Shoes,Casual Shoes,Brown,Summer,2012,Casual,ADIDAS Men Brown Mudslide Shoes,42020.jpg
1481,47552,Women,Footwear,Shoes,Heels,Brown,Winter,2012,Casual,Portia Women Brown Heels,47552.jpg
1482,54979,Women,Apparel,Topwear,Shirts,White,Summer,2012,Casual,Femella Women White Printed Shirt,54979.jpg
1483,6675,Men,Footwear,Shoes,Sports Shoes,White,Summer,2011,Sports,Nike Men's Free White Grey Shoe,6675.jpg
1485,51437,Women,Apparel,Topwear,Tops,Peach,Summer,2012,Casual,Myntra Women Multi Coloured Printed Top,51437.jpg
1489,4122,Unisex,Footwear,Shoes,Casual Shoes,Black,Summer,2011,Casual,Puma Unisex Lo Punk Black Yellow Shoe,4122.jpg
1490,21740,Unisex,Footwear,Shoes,Casual Shoes,Brown,Fall,2011,Casual,Vans Unisex Authentic Lo Pro Brown Casual Shoes,21740.jpg
1496,33285,Men,Apparel,Topwear,Tshirts,Blue,Summer,2012,Casual,Arrow Sport Men Striped Blue Polo T-shirt,33285.jpg
1497,40777,Men,Footwear,Flip Flops,Flip Flops,White,Summer,2012,Casual,Quiksilver Men White Flip Flops,40777.jpg
1498,10007,Women,Apparel,Topwear,Tshirts,White,Fall,2011,Sports,Nike Women As Trophy Swo White T-Shirts,10007.jpg
1499,21586,Men,Apparel,Bottomwear,Jeans,Grey,Summer,2011,Casual,Locomotive Men Washed Grey Jeans,21586.jpg
1500,52074,Men,Apparel,Topwear,Tshirts,Yellow,Summer,2012,Casual,Myntra Men Yellow & Blue T-shirt,52074.jpg
