id,gender,masterCategory,subCategory,articleType,baseColour,season,year,usage,productDisplayName,image
3994,19579,Women,Apparel,Topwear,Tops,Green,Summer,2011,Casual,United Colors of Benetton Women Green Top,19579.jpg
3995,12191,Men,Apparel,Topwear,Shirts,Brown,Fall,2011,Casual,Basics Men Brown Slim Fit Shirt,12191.jpg
3996,55656,Women,Footwear,Shoes,Heels,Brown,Winter,2015,Casual,Catwalk Women Brown Wedges,55656.jpg
3997,31313,Women,Apparel,Topwear,Kurtas,Blue,Summer,2012,Ethnic,W Women Blue Kurta,31313.jpg
3998,50324,Women,Apparel,Topwear,Kurtas,Peach,Summer,2012,Ethnic,Aurelia Women Peach Kurta,50324.jpg
4000,7166,Men,Apparel,Topwear,Shirts,Red,Fall,2011,Casual,Scullers Men Scul Red White Shirt,7166.jpg
4001,46241,Women,Apparel,Topwear,Kurtas,Cream,Summer,2012,Ethnic,Fusion Beats Women Cream Kurta,46241.jpg
4002,8912,Men,Footwear,Shoes,Sports Shoes,White,Fall,2011,Sports,Puma Men Cabana Racer Sketch White Sports Shoes,8912.jpg
4003,22704,Men,Footwear,Shoes,Casual Shoes,White,Fall,2011,Casual,Nike Men Capri II Mid White Casual Shoes,22704.jpg
4010,4387,Men,Apparel,Topwear,Tshirts,Grey,Summer,2011,Casual,Batman Men's Affliction Grey Violet T-shirt,4387.jpg
4011,33020,Women,Apparel,Topwear,Kurtas,Yellow,Summer,2012,Ethnic,Mother Earth Women Printed Yellow Kurta,33020.jpg
4012,41400,Women,Apparel,Topwear,Tshirts,Navy Blue,Summer,2012,Casual,Wrangler Women Navy Blue T-shirt,41400.jpg
4016,16969,Men,Footwear,Sandal,Sandals,Black,Fall,2011,Casual,Puma Men Coupe Black Sandal,16969.jpg
4017,43357,Men,Footwear,Shoes,Sports Shoes,Black,Summer,2012,Sports,Reebok Men Black Ultimate Vibe Sports Shoes,43357.jpg
4018,9498,Men,Apparel,Topwear,Shirts,Pink,Fall,2011,Formal,John Miller Men Pink white black check Pink Shirts,9498.jpg
4019,13427,Men,Apparel,Topwear,Tshirts,Red,Summer,2011,Casual,United Colors of Benetton Men Printed Red Tshirts,13427.jpg
4025,29788,Men,Apparel,Topwear,Tshirts,White,Summer,2013,Casual,Basics Men Pack of 3 T-shirts,29788.jpg
4026,22360,Men,Apparel,Topwear,Shirts,Blue,Fall,2011,Casual,John Players Men Check Blue Shirt,22360.jpg
4030,31545,Men,Apparel,Topwear,Tshirts,Purple,Summer,2012,Casual,Classic Polo Men Striped Purple T-shirt,31545.jpg
4032,8778,Men,Apparel,Topwear,Shirts,Black,Fall,2011,Casual,Indigo Nation Men Black Striped Shirt,8778.jpg
4038,2242,Men,Apparel,Topwear,Tshirts,Blue,Fall,2010,Casual,ADIDAS Men Crew Neck Blue T-shirt,2242.jpg
4039,16367,Men,Apparel,Topwear,Shirts,Blue,Fall,2011,Formal,Peter England Men Check Blue Shirt,16367.jpg
4040,22152,Men,Footwear,Sandal,Sandals,Olive,Summer,2011,Casual,Lee Cooper Men Casual Sandals,22152.jpg
4041,7730,Men,Footwear,Sandal,Sandals,Black,Fall,2011,Casual,Puma Men Apex Black Olive Sandal,7730.jpg
4044,28468,Women,Apparel,Topwear,Tshirts,Lavender,Summer,2012,Casual,Urban Yoga Women Printed Lavender T-shirt,28468.jpg
4045,43959,Men,Footwear,Sandal,Sandals,Grey,Summer,2012,Casual,Puma Men Grey Sandals,43959.jpg
4047,14430,Women,Footwear,Shoes,Casual Shoes,Black,Summer,2012,Casual,Enroute Women Casual Black Casual Shoes,14430.jpg
4052,33212,Women,Apparel,Topwear,Tops,Black,Summer,2012,Casual,Sepia Women Black Top,33212.jpg
4057,39728,Women,Apparel,Topwear,Shirts,Pink,Summer,2012,Formal,Arrow Woman Women Pink Shirt,39728.jpg
4060,53131,Women,Footwear,Shoes,Heels,Gold,Winter,2015,Casual,Catwalk Women Gold Toned & Brown Flats,53131.jpg
4062,15724,Men,Footwear,Shoes,Sports Shoes,Grey,Fall,2011,Sports,Nike Men Free Run+ 2 Shield Grey Sports Shoes,15724.jpg
4063,4373,Men,Apparel,Topwear,Tshirts,Black,Summer,2011,Casual,Aerosmith Men's Attic Black T-shirt,4373.jpg
4064,10256,Men,Apparel,Topwear,Shirts,Green,Fall,2011,Casual,Locomotive Men Stripes Green Shirts,10256.jpg
4069,11384,Men,Apparel,Topwear,Shirts,Red,Fall,2011,Casual,United Colors of Benetton Men White & Red Check Shirt,11384.jpg
4070,12501,Men,Apparel,Topwear,Tshirts,Green,Fall,2011,Casual,United Colors of Benetton Men Short Green T-shirt,12501.jpg
4072,31783,Women,Apparel,Topwear,Tops,Purple,Summer,2012,Casual,Lee Women Purple Paula Pansy Top,31783.jpg
4074,42271,Unisex,Footwear,Shoes,Casual Shoes,White,Summer,2012,Casual,Vans Unisex White Classic Slip On Casual Shoes,42271.jpg
4082,6424,Men,Footwear,Flip Flops,Flip Flops,Navy Blue,Summer,2011,Casual,Lotto Men's Tennis Mule Navy Blue Flip Flop,6424.jpg
4083,3364,Men,Apparel,Topwear,Tshirts,Blue,Summer,2011,Casual,Myntra Men's Brain Blue T-shirt,3364.jpg
4084,42043,Men,Footwear,Shoes,Casual Shoes,Black,Summer,2012,Casual,Nike Men Black Shoes,42043.jpg
4086,54126,Women,Footwear,Shoes,Heels,Bronze,Winter,2012,Casual,Rocia Women Bronze Heels,54126.jpg
4089,23848,Men,Footwear,Shoes,Sports Shoes,White,Fall,2011,Sports,ADIDAS Men White Razor Sports Shoes,23848.jpg
4092,16393,Men,Apparel,Topwear,Shirts,Black,Fall,2011,Casual,Levis Men Check Black Shirts,16393.jpg
4093,51454,Women,Apparel,Topwear,Tops,Multi,Summer,2012,Casual,Tonga Women Multicoloured Top,51454.jpg
4095,47531,Women,Footwear,Shoes,Flats,Gold,Winter,2012,Casual,Portia Women Purple & Gold-Toned Sandals,47531.jpg
4096,6616,Men,Apparel,Topwear,Shirts,Pink,Summer,2011,Casual,Spykar Men Linen Pink Shirt,6616.jpg
4098,17241,Men,Apparel,Topwear,Tshirts,Pink,Fall,2011,Casual,U.S. Polo Assn. Men Stripes Raspberry Wine Polo Tshirt,17241.jpg
4099,53303,Men,Apparel,Topwear,Tshirts,Red,Summer,2012,Casual,Locomotive Men Red T-shirt,53303.jpg
4100,10858,Men,Apparel,Topwear,Tshirts,White,Fall,2011,Casual,Wrangler Men Furious Rides White T-Shirts,10858.jpg
4102,5093,Men,Apparel,Topwear,Tshirts,Black,Summer,2011,Casual,Wrangler Men's Champion Burnt Out Striper Black T-shirt,5093.jpg
4105,4141,Men,Footwear,Shoes,Casual Shoes,White,Summer,2011,Casual,Fila Men's Breath White Red Shoe,4141.jpg
4106,21723,Women,Footwear,Shoes,Heels,Beige,Winter,2015,Casual,Catwalk Women Casual Beige Heels,21723.jpg
4107,15516,Men,Footwear,Flip Flops,Flip Flops,Navy Blue,Fall,2011,Casual,Rockport Men Altrezlp Navy Blue Flip Flops,15516.jpg
4109,10064,Men,Apparel,Topwear,Tshirts,Yellow,Fall,2011,Casual,Puma Men puma shield tee Yellow Tshirts,10064.jpg
4110,24251,Men,Footwear,Shoes,Casual Shoes,Black,Summer,2013,Casual,Numero Uno Men Black Casual Shoes,24251.jpg
4115,54542,Men,Footwear,Shoes,Sports Shoes,White,Fall,2012,Sports,F Sports Men White Hurricane Sports Shoes,54542.jpg
4116,3700,Women,Apparel,Topwear,Tshirts,Purple,Summer,2011,Casual,Tantra Women's Flower Heart Lavender Long T-shirt,3700.jpg
4117,42427,Women,Apparel,Topwear,Kurtas,Green,Summer,2012,Ethnic,Aurelia Women Green Kurta,42427.jpg
4120,12357,Men,Apparel,Topwear,Shirts,Blue,Fall,2011,Formal,Reid & Taylor Men Check Blue Shirts,12357.jpg
4121,26162,Men,Apparel,Bottomwear,Trousers,Black,Summer,2012,Formal,John Miller Men Black Trousers,26162.jpg
4123,6272,Men,Apparel,Topwear,Tshirts,Grey,Summer,2011,Casual,UCB Men's Contrast Rib Grey T-shirt,6272.jpg
4127,35575,Men,Footwear,Flip Flops,Flip Flops,Green,Summer,2013,Casual,Gliders Men Green Esquire Flip Flops,35575.jpg
4128,46087,Women,Footwear,Shoes,Casual Shoes,Silver,Summer,2012,Casual,ADIDAS Women Silver Magique Shoes,46087.jpg
4130,4525,Men,Footwear,Shoes,Sports Shoes,White,Summer,2011,Sports,Puma Men's YugoRun White Red Shoe,4525.jpg
4132,15172,Men,Apparel,Topwear,Tshirts,Brown,Fall,2011,Casual,Arrow Sport Men Striped Brown T-shirt,15172.jpg
4133,53767,Men,Apparel,Topwear,Tshirts,White,Summer,2012,Casual,Puma Men White and Blue T-shirt,53767.jpg
4134,20295,Men,Apparel,Topwear,Tshirts,Blue,Fall,2010,Casual,Flying Machine Men Printed Blue Tshirt,20295.jpg
4138,21175,Men,Footwear,Shoes,Sports Shoes,White,Fall,2011,Sports,ADIDAS Men Lowell White Sports Shoe,21175.jpg
4143,38864,Women,Apparel,Topwear,Tops,Purple,Summer,2012,Casual,Latin Quarters Women Purple & White Top,38864.jpg
4145,32562,Women,Apparel,Bottomwear,Trousers,Olive,Summer,2012,Casual,ONLY Women Olive Trousers,32562.jpg
4148,10632,Men,Footwear,Shoes,Casual Shoes,Brown,Winter,2012,Casual,Carlton London Men Brown Shoes,10632.jpg
4149,24407,Women,Apparel,Topwear,Kurtas,Pink,Summer,2012,Ethnic,Vishudh Women Pink Printed Kurta,24407.jpg
4153,30235,Men,Footwear,Flip Flops,Flip Flops,Brown,Summer,2012,Casual,Numero Uno Men Brown Flip Flops,30235.jpg
4154,27282,Women,Apparel,Topwear,Kurtas,Blue,Fall,2011,Ethnic,Mother Earth Women Blue Kurta,27282.jpg
4157,3532,Women,Apparel,Topwear,Tshirts,Black,Summer,2011,Casual,Myntra Women's Hard Work Never Black T-shirt,3532.jpg
4159,9834,Women,Apparel,Topwear,Tshirts,Blue,Fall,2011,Casual,Little Miss Women Printed Blue T-shirt,9834.jpg
4162,6040,Men,Apparel,Topwear,Tshirts,Grey,Summer,2011,Casual,UCB Men's Applique Grey T-shirt,6040.jpg
4163,12959,Men,Footwear,Shoes,Sports Shoes,Black,Fall,2011,Sports,ADIDAS Men Sports Black Sports Shoes,12959.jpg
4164,7192,Women,Apparel,Bottomwear,Jeans,Brown,Fall,2011,Casual,Jealous 21 Women Brown Jeggings,7192.jpg
4167,34635,Men,Footwear,Shoes,Casual Shoes,Black,Summer,2012,Casual,Lotto Men XD III Black Shoes,34635.jpg
4168,23682,Men,Footwear,Shoes,Casual Shoes,Black,Summer,2012,Casual,Red Tape Men Black Casual Shoes,23682.jpg
4169,9894,Men,Apparel,Bottomwear,Trousers,Black,Fall,2011,Formal,Indian Terrain Men Sid Black Trousers,9894.jpg
4170,8946,Men,Apparel,Bottomwear,Trousers,Beige,Fall,2011,Casual,Indigo Nation Men ID Printed Beige Trousers,8946.jpg
4171,22750,Women,Apparel,Topwear,Kurtas,White,Fall,2011,Ethnic,BIBA Women Printed White Kurta,22750.jpg
4172,7132,Women,Apparel,Topwear,Tshirts,Green,Fall,2011,Casual,Urban Yoga Women's Green T-shirt,7132.jpg
4173,46215,Men,Footwear,Shoes,Sports Shoes,Orange,Summer,2012,Sports,ADIDAS Men Orange Sports Shoes,46215.jpg
4175,30295,Men,Apparel,Topwear,Tshirts,Off White,Summer,2012,Casual,Myntra Men Planet Off White T-shirt,30295.jpg
4176,3592,Men,Footwear,Shoes,Casual Shoes,Blue,Summer,2013,Casual,Converse Men's All Star Canvas Ox Navy Blue Shoe,3592.jpg
4177,25575,Men,Footwear,Shoes,Sports Shoes,White,Summer,2012,Sports,Fila Men Surveillance White Shoes,25575.jpg
4179,11740,Men,Apparel,Topwear,Tshirts,Grey,Fall,2011,Casual,Lee Men Stripes Grey T-shirt,11740.jpg
4183,10692,Men,Apparel,Topwear,Tshirts,Red,Fall,2011,Casual,Doodle Boy Casual Red Tshirts,10692.jpg
4184,57155,Women,Apparel,Topwear,Tops,Pink,Summer,2012,Casual,Elle Women Pink Top,57155.jpg
4186,20007,Men,Apparel,Topwear,Tshirts,White,Fall,2011,Casual,United Colors of Benetton Men White Printed T-shirt,20007.jpg
4188,5665,Men,Footwear,Flip Flops,Flip Flops,Grey,Summer,2011,Casual,ADIDAS Men's Slide Grey Orange Flip Flop,5665.jpg
4191,11572,Women,Apparel,Topwear,Kurtas,White,Summer,2011,Ethnic,W Women Printed White Kurtas,11572.jpg
4193,24695,Men,Footwear,Sandal,Sandals,Black,Summer,2011,Casual,Lotto Men Hermes Black Sandals,24695.jpg
4197,37282,Women,Apparel,Topwear,Tshirts,Purple,Summer,2012,Casual,Tantra Women Purple Prima Donna T-shirt,37282.jpg
4199,44770,Men,Footwear,Shoes,Casual Shoes,Black,Summer,2012,Casual,Globalite Men Black Skid Shoes,44770.jpg
4201,20235,Women,Apparel,Topwear,Tshirts,Black,Fall,2011,Casual,Wrangler Women Baroque Black T-shirt,20235.jpg
4204,17685,Women,Footwear,Shoes,Heels,Multi,Winter,2015,Casual,Catwalk Women Assorted Multi Heels,17685.jpg
4205,7300,Men,Apparel,Topwear,Tshirts,Red,Fall,2011,Casual,Free Authority Men's Abstract Mix Red T-shirt,7300.jpg
4208,31949,Men,Footwear,Shoes,Sports Shoes,White,Summer,2012,Sports,Nike Men Zoom Vomero White Sports Shoes,31949.jpg
4220,41666,Men,Apparel,Topwear,Shirts,Purple,Summer,2012,Formal,Mark Taylor Men Brown Striped Shirt,41666.jpg
4221,32394,Women,Apparel,Topwear,Shirts,Lavender,Summer,2012,Formal,Arrow Woman Lavender Shirt,32394.jpg
4223,11116,Men,Apparel,Topwear,Shirts,Grey,Fall,2011,Formal,Indigo Nation Men Solid Grey Shirts,11116.jpg
4226,36734,Women,Apparel,Topwear,Tshirts,White,Summer,2012,Casual,Spykar Women Cult White T-shirt,36734.jpg
4228,7764,Men,Apparel,Topwear,Tshirts,Black,Fall,2011,Casual,Inkfruit Men's Night Rider Black Yellow Orange T-shirt,7764.jpg
4230,16333,Men,Apparel,Topwear,Shirts,Black,Fall,2011,Formal,Peter England Men Stripes Black Shirt,16333.jpg
4232,47591,Women,Footwear,Shoes,Heels,Black,Winter,2012,Casual,Portia Women Black Flats,47591.jpg
4235,12793,Women,Apparel,Topwear,Tshirts,Maroon,Fall,2011,Casual,Nike Women Blue Grafitti Maroon Tshirts,12793.jpg
4239,13641,Women,Footwear,Shoes,Heels,Navy Blue,Winter,2012,Casual,Carlton London Women Casual Navy Flats,13641.jpg
4242,22334,Men,Apparel,Topwear,Tshirts,Red,Fall,2011,Casual,John Players Men Stripes Red Polo T-Shirt,22334.jpg
4243,19975,Men,Apparel,Topwear,Tshirts,Red,Fall,2011,Casual,United Colors of Benetton Men Red Polo TShirt,19975.jpg
4245,7556,Men,Apparel,Topwear,Tshirts,Blue,Summer,2011,Sports,Nike Men's Aqua Polo T-shirt,7556.jpg
4248,6484,Men,Apparel,Topwear,Tshirts,Black,Summer,2011,Casual,ADIDAS Men's Black Strip T-shirt,6484.jpg
4251,49639,Women,Apparel,Topwear,Tops,Green,Summer,2012,Casual,Mineral Women Lime Green Top,49639.jpg
4253,19149,Men,Apparel,Topwear,Tshirts,White,Summer,2011,Casual,United Colors of Benetton Men Solid White Polo Tshirt,19149.jpg
4254,26794,Men,Apparel,Topwear,Shirts,Grey,Summer,2013,Formal,Arrow Men Grey Shirt,26794.jpg
4255,27646,Men,Apparel,Topwear,Tshirts,Black,Summer,2012,Casual,Che Guevara Men Printed Black T-shirt,27646.jpg
4256,13473,Women,Footwear,Shoes,Flats,White,Winter,2012,Casual,Rocia Women White Heels,13473.jpg
4258,2024,Men,Apparel,Topwear,Tshirts,Red,Fall,2010,Casual,ADIDAS Mens Fitted Red T-shirt,2024.jpg
4259,33074,Men,Apparel,Topwear,Tshirts,Green,Summer,2012,Casual,U.S.Polo Assn. Men Green Polo T-shirt,33074.jpg
4260,40586,Women,Apparel,Topwear,Kurtas,White,Summer,2012,Ethnic,Aurelia Women White Kurta,40586.jpg
4261,57531,Men,Footwear,Shoes,Casual Shoes,Mushroom Brown,Fall,2012,Casual,Provogue Men Mushroom Brown Casual Shoes,57531.jpg
4264,41454,Men,Footwear,Shoes,Casual Shoes,White,Fall,2012,Casual,Lee Cooper Men White Shoes,41454.jpg
4265,14656,Men,Apparel,Topwear,Tshirts,White,Fall,2011,Casual,Probase Men Funky Print White Tshirts,14656.jpg
4266,33848,Men,Footwear,Shoes,Casual Shoes,Brown,Summer,2012,Casual,Puma Men Drift Cat Brown Shoes,33848.jpg
4268,5201,Men,Apparel,Topwear,Tshirts,Blue,Summer,2011,Casual,Superman Men's Anger Moon Blue T-shirt,5201.jpg
4273,10030,Women,Apparel,Topwear,Tshirts,Black,Fall,2011,Sports,Nike Women As See The Win Black T-Shirts,10030.jpg
4274,40740,Unisex,Footwear,Flip Flops,Flip Flops,Red,Summer,2012,Casual,Converse Unisex Red Flip Flops,40740.jpg
4275,41692,Women,Footwear,Shoes,Heels,Gold,Winter,2012,Casual,Catwalk Women Gold Heels,41692.jpg
4277,39788,Men,Apparel,Topwear,Shirts,Purple,Summer,2012,Formal,Peter England Men Maroon Purple Shirt,39788.jpg
4279,14490,Men,Footwear,Shoes,Casual Shoes,Grey,Fall,2011,Casual,Flying Machine Men Casual Grey Casual Shoes,14490.jpg
4281,15542,Women,Footwear,Shoes,Heels,Multi,Winter,2015,Casual,Catwalk Women Casual Multi Flats,15542.jpg
4283,7790,Men,Apparel,Topwear,Tshirts,Olive,Fall,2011,Casual,Proline Men Olive Green Polo T-shirt,7790.jpg
4285,51400,Men,Apparel,Topwear,Shirts,Yellow,Summer,2012,Formal,Myntra Men Yellow Shirt,51400.jpg
4287,47565,Women,Footwear,Shoes,Flats,Black,Winter,2012,Casual,Portia Women Black Flats,47565.jpg
4288,6642,Men,Footwear,Shoes,Sports Shoes,White,Summer,2011,Sports,Nike Men's Air Max Lte White Blue Shoe,6642.jpg
4290,26552,Men,Footwear,Shoes,Casual Shoes,Black,Summer,2012,Casual,ID Men Black Shoes,26552.jpg
4291,3330,Men,Apparel,Topwear,Tshirts,Red,Summer,2011,Sports,RCB Mens Fangear Polo Jersey,3330.jpg
4292,42017,Men,Footwear,Shoes,Sports Shoes,White,Summer,2012,Sports,ADIDAS Men White Phaedra Sports Shoes,42017.jpg
4297,19981,Men,Apparel,Topwear,Tshirts,White,Summer,2011,Casual,United Colors of Benetton Men Printed White TShirt,19981.jpg
4298,6470,Men,Footwear,Shoes,Casual Shoes,Brown,Summer,2011,Casual,Numero Uno Men's Beige Brown Casual Shoe,6470.jpg
4301,3102,Men,Apparel,Topwear,Tshirts,Grey,Summer,2011,Casual,Probase Men's Boarding Grey T-shirt,3102.jpg
4302,42225,Women,Apparel,Topwear,Tops,Blue,Summer,2012,Casual,Sepia Women Blue Top,42225.jpg
4305,13487,Men,Apparel,Topwear,Shirts,Blue,Fall,2011,Casual,Spykar Men Stripes Blue Shirts,13487.jpg
4308,33080,Men,Apparel,Topwear,Tshirts,White,Summer,2012,Casual,U.S. Polo Assn. Denim Co. Men Printed Cream T-Shirt,33080.jpg
4310,40572,Women,Apparel,Topwear,Kurtas,Blue,Summer,2012,Ethnic,W Women Blue Kurta,40572.jpg
4312,24037,Men,Apparel,Topwear,Tshirts,Beige,Fall,2011,Casual,Locomotive Men Printed Beige T-shirt,24037.jpg
4316,4327,Unisex,Apparel,Topwear,Tshirts,Blue,Summer,2011,Casual,Tantra Kid's Unisex Cute Mom Turqoise Kidswear,4327.jpg
4320,6014,Men,Apparel,Topwear,Shirts,Black,Summer,2011,Casual,Highlander Men Black & White Checked Slim Fit Shirt,6014.jpg
4321,23676,Men,Footwear,Sandal,Sandals,Black,Summer,2012,Casual,Red Tape Men Cross Band Black Sandals,23676.jpg
4324,9860,Men,Apparel,Topwear,Tshirts,Green,Fall,2011,Casual,Status Quo Men Green Polo Tshirts,9860.jpg
4326,35713,Men,Footwear,Shoes,Sports Shoes,Red,Summer,2012,Sports,Nike Men Jordan Fly Wade Red Sports Shoes,35713.jpg
4330,3566,Men,Footwear,Shoes,Sports Shoes,White,Summer,2011,Sports,ADIDAS Men's White Silver Running Shoe,3566.jpg
4331,42641,Women,Apparel,Topwear,Kurtas,Blue,Summer,2012,Ethnic,W Women Blue Kurta,42641.jpg
4332,12131,Women,Apparel,Topwear,Kurtas,Purple,Fall,2011,Ethnic,Aurelia Women Solid Purple Kurtas,12131.jpg
4336,24453,Men,Footwear,Shoes,Sports Shoes,Blue,Summer,2012,Sports,Nike Men Free Run Blue Sports Shoes,24453.jpg
4337,4743,Women,Footwear,Shoes,Casual Shoes,Red,Summer,2011,Casual,Numero Uno Women Dna Red Shoe,4743.jpg
4338,21121,Men,Apparel,Topwear,Shirts,Navy Blue,Fall,2011,Casual,s.Oliver Men Check Navy Blue Shirt,21121.jpg
4339,15314,Men,Footwear,Shoes,Sports Shoes,White,Fall,2011,Sports,ADIDAS Men Ranger White Sports Shoes,15314.jpg
4341,5691,Men,Footwear,Shoes,Casual Shoes,White,Winter,2015,Casual,Skechers Men's Regions Off White Shoe,5691.jpg
4342,11586,Women,Apparel,Topwear,Kurtas,Beige,Summer,2011,Ethnic,W Women Printed Beige Kurtas,11586.jpg
4345,10454,Men,Apparel,Topwear,Tshirts,Yellow,Fall,2011,Casual,Flying Machine Men Gloden Haze Yellow Tshirts,10454.jpg
4349,4571,Women,Footwear,Shoes,Sports Shoes,Purple,Winter,2011,Sports,Nike Women Air Max Trainer Excel Purple Sports Shoes,4571.jpg
4350,44784,Men,Footwear,Shoes,Sports Shoes,White,Summer,2012,Casual,Lotto Men White Torcida Shoes,44784.jpg
4352,17671,Women,Footwear,Shoes,Heels,Beige,Winter,2015,Casual,Catwalk Women Fancy Beige Heels,17671.jpg
4354,6226,Men,Apparel,Topwear,Tshirts,Pink,Summer,2011,Casual,Lee Men's Medal Pink Granite T-shirt,6226.jpg
4355,35521,Men,Footwear,Flip Flops,Flip Flops,Blue,Winter,2015,Casual,Bata Men Sandy Blue Flip Flops,35521.jpg
4356,22596,Men,Apparel,Topwear,Tshirts,Red,Fall,2011,Sports,Nike Men Red T-shirt,22596.jpg
4360,2686,Women,Apparel,Topwear,Tshirts,Black,Summer,2011,Casual,Inkfruit Women's Chirfhy Black T-shirt,2686.jpg
4361,18639,Men,Apparel,Topwear,Tshirts,Navy Blue,Fall,2011,Sports,Puma Men V.11 Cat Midnight Navy Tshirts,18639.jpg
4362,54516,Men,Footwear,Shoes,Sports Shoes,White,Fall,2012,Sports,F Sports Men White Velocity Sports Shoes,54516.jpg
4363,12303,Men,Apparel,Topwear,Shirts,Red,Fall,2011,Formal,Genesis Men Check Red Shirts,12303.jpg
4364,26136,Men,Apparel,Bottomwear,Trousers,Black,Summer,2012,Formal,John Miller Men Black Trousers,26136.jpg
4365,31181,Men,Apparel,Topwear,Tshirts,Blue,Summer,2012,Casual,Nike Men Printed Blue T-shirt,31181.jpg
4366,3754,Men,Apparel,Topwear,Tshirts,Blue,Summer,2011,Casual,Status Quo Men's Music Revolution Blue T-shirt,3754.jpg
4368,44925,Men,Apparel,Bottomwear,Trousers,Brown,Summer,2012,Casual,Jack & Jones Men Brown Jeans,44925.jpg
4369,32199,Men,Apparel,Topwear,Kurtas,Beige,Summer,2012,Ethnic,Fabindia Men Printed Beige Kurta,32199.jpg
4371,39571,Women,Footwear,Shoes,Heels,Black,Winter,2015,Casual,Catwalk Women Black Flats,39571.jpg
4372,14669,Men,Apparel,Topwear,Shirts,Blue,Fall,2011,Casual,Basics Men Blue Slim Fit Striped Shirt,14669.jpg
4376,7569,Men,Apparel,Topwear,Tshirts,Blue,Summer,2011,Sports,Nike Men's As Miler UV SS Blue T-shirt,7569.jpg
4377,18898,Women,Apparel,Topwear,Shirts,White,Fall,2011,Casual,Arrow Woman Solid White Shirt,18898.jpg
4380,49606,Women,Footwear,Shoes,Heels,Silver,Winter,2015,Casual,Catwalk Women Metal Grey Heels,49606.jpg
4382,16902,Men,Apparel,Topwear,Tshirts,Red,Fall,2011,Casual,Status Quo Men Stripes White Tshirt,16902.jpg
4384,19176,Men,Apparel,Topwear,Shirts,Black,Fall,2011,Casual,United Colors of Benetton Men Check Black Shirt,19176.jpg
4389,43932,Women,Footwear,Shoes,Heels,Blue,Winter,2012,Casual,Catwalk Women Blue Heels,43932.jpg
4393,26599,Men,Footwear,Shoes,Sports Shoes,Blue,Summer,2012,Sports,Puma Men Faas 300 Blue Sports Shoes,26599.jpg
4395,22905,Men,Apparel,Bottomwear,Trousers,Charcoal,Summer,2011,Formal,Mark Taylor Men Black Striped Trousers,22905.jpg
4396,49434,Unisex,Footwear,Shoes,Casual Shoes,Blue,Fall,2012,Casual,Vans Unisex Blue Authentic Shoes,49434.jpg
4398,2229,Men,Apparel,Topwear,Tshirts,White,Fall,2010,Sports,ADIDAS Men Sunset White Polo T-shirt,2229.jpg
4399,34860,Men,Footwear,Shoes,Casual Shoes,Black,Summer,2012,Casual,Vans Men Era Black Shoes,34860.jpg
4400,18296,Women,Apparel,Topwear,Kurtas,Pink,Fall,2011,Ethnic,Aneri Women Ekta Pink Kurta,18296.jpg
4401,5830,Men,Apparel,Topwear,Tshirts,White,Summer,2011,Casual,Puma Men Edition White T-shirt,5830.jpg
4402,33279,Unisex,Apparel,Bottomwear,Jeans,Blue,Summer,2012,Casual,Gini and Jony Kids Unisex Blue Jeans,33279.jpg
4408,34438,Women,Apparel,Topwear,Tshirts,White,Summer,2012,Casual,Myntra Women Cute Dog White T-shirt,34438.jpg
4410,46018,Women,Apparel,Topwear,Kurtas,Green,Summer,2012,Ethnic,Fabindia Women Green Kurta,46018.jpg
4412,31976,Women,Footwear,Shoes,Sports Shoes,Grey,Summer,2012,Sports,Nike Women Lunarswift +3 Grey Sports Shoes,31976.jpg
4416,46824,Women,Footwear,Shoes,Heels,Blue,Winter,2015,Casual,Catwalk Women Blue Shoes,46824.jpg
4417,19720,Men,Apparel,Topwear,Shirts,Black,Fall,2011,Casual,United Colors of Benetton Men Black Striped Shirt,19720.jpg
4425,5468,Men,Footwear,Shoes,Sports Shoes,White,Summer,2011,Sports,Nike Men's Lunareclipse White Shoe,5468.jpg
4427,20804,Men,Footwear,Shoes,Sports Shoes,White,Fall,2010,Sports,Fila Men Streak White Sports Shoes,20804.jpg
4428,24498,Women,Apparel,Topwear,Kurtas,Brown,Fall,2011,Ethnic,Mother Earth Women Brown Printed Kurta,24498.jpg
4429,56884,Women,Footwear,Shoes,Heels,Black,Winter,2012,Casual,HM Women Black Heels,56884.jpg
4430,4788,Men,Apparel,Topwear,Tshirts,White,Summer,2011,Sports,ADIDAS Men's Demon White T-shirt,4788.jpg
4432,41833,Men,Footwear,Shoes,Casual Shoes,Blue,Fall,2012,Casual,Skechers Men Blue Shoes,41833.jpg
4435,13814,Men,Apparel,Topwear,Tshirts,Blue,Fall,2011,Casual,Proline Pack of 3 Printed T-shirts,13814.jpg
4437,8979,Men,Footwear,Shoes,Sports Shoes,Black,Fall,2011,Sports,Puma Men Driving Power Lo SF Black Sports Shoes,8979.jpg
4438,13028,Women,Footwear,Shoes,Heels,Black,Winter,2012,Casual,Inc 5 Women Casual Black Heels,13028.jpg
4439,9097,Unisex,Footwear,Shoes,Casual Shoes,Green,Fall,2011,Casual,Converse Unisex Ct AsAll Star 08 Hi Green Casual Shoes,9097.jpg
4443,30850,Women,Apparel,Topwear,Kurtas,Multi,Summer,2012,Ethnic,Fabindia Women Printed Multi Coloured Kurta,30850.jpg
4445,6219,Men,Apparel,Topwear,Tshirts,White,Summer,2011,Casual,Lee Men's Quill White T-shirt,6219.jpg
4448,9251,Men,Apparel,Topwear,Shirts,Green,Fall,2011,Formal,Mark Taylor Men Green Striped Shirt,9251.jpg
4450,54529,Men,Footwear,Shoes,Casual Shoes,Black,Fall,2012,Casual,F Sports Men Black Shoes,54529.jpg
4456,15119,Men,Apparel,Bottomwear,Trousers,Grey,Fall,2012,Formal,Arrow Men Stripes Grey Trousers,15119.jpg
4458,37249,Men,Footwear,Shoes,Casual Shoes,Brown,Summer,2012,Casual,United Colors of Benetton Men Brown Shoes,37249.jpg
4461,59838,Men,Apparel,Topwear,Shirts,Navy Blue,Summer,2010,Casual,United Colors of Benetton Men Navy Blue Shirt,59838.jpg
4467,56870,Women,Footwear,Shoes,Casual Shoes,Brown,Winter,2012,Casual,HM Women Brown Shoes,56870.jpg
4470,23649,Men,Apparel,Topwear,Tshirts,White,Summer,2012,Casual,Disney Men White Printed T-shirt,23649.jpg
4472,12932,Men,Apparel,Topwear,Tshirts,Pink,Fall,2011,Casual,Classic Polo Men Insignia Pink Tshirts,12932.jpg
4473,6817,Men,Footwear,Flip Flops,Flip Flops,Blue,Summer,2011,Casual,Timberland Men Blue Thong Flip Flops,6817.jpg
4475,9063,Men,Apparel,Topwear,Shirts,Pink,Fall,2011,Formal,Mark Taylor Men Pink Striped Shirt,9063.jpg
4477,3559,Men,Footwear,Shoes,Casual Shoes,Brown,Winter,2015,Casual,Skechers Men's Casual Brown Lifestyle Shoe,3559.jpg
4480,45803,Women,Footwear,Shoes,Heels,Silver,Fall,2012,Casual,Senorita Women Silver Flats,45803.jpg
4481,39585,Women,Footwear,Shoes,Heels,Black,Winter,2015,Casual,Catwalk Women Black Flats,39585.jpg
4484,4318,Men,Apparel,Topwear,Tshirts,Orange,Summer,2011,Casual,Tantra Kid's Men Kya Boss Orange Kidswear,4318.jpg
4485,32951,Men,Footwear,Shoes,Casual Shoes,Brown,Summer,2012,Casual,ADIDAS Neo Men Court Sequence Mid Brown Shoes,32951.jpg
4486,52088,Women,Apparel,Topwear,Tshirts,Grey,Summer,2012,Casual,Myntra Women Grey T-shirt,52088.jpg
4489,17018,Women,Footwear,Shoes,Flats,Yellow,Winter,2012,Casual,Rocia Women Casual yellow Sandal,17018.jpg
4490,19182,Men,Apparel,Topwear,Shirts,Maroon,Fall,2011,Casual,United Colors Of Benetton Men Maroon Check Shirt,19182.jpg
4492,17824,Unisex,Footwear,Sandal,Sandals,Black,Fall,2011,Casual,Nike Unisex Air Deschutz Black Sandal,17824.jpg
4493,9407,Men,Footwear,Shoes,Sports Shoes,White,Fall,2011,Sports,Nike Men Court White Shoe,9407.jpg
4499,12758,Men,Apparel,Bottomwear,Jeans,Blue,Fall,2011,Casual,Spykar Men Washed Blue Jeans,12758.jpg
4500,42028,Women,Footwear,Shoes,Sports Shoes,White,Fall,2012,Sports,ADIDAS Women White Sukoi Sports Shoes,42028.jpg
4501,9635,Men,Apparel,Topwear,Shirts,White,Fall,2011,Formal,Indigo Nation Men Price catch Blue White Shirts,9635.jpg
4502,23823,Men,Footwear,Flip Flops,Flip Flops,Blue,Summer,2012,Casual,Puma Men Breeze Blue Flip Flops,23823.jpg
